,0
979, We will need an inquiry to learn from rollout mistakes
980, Premier's gambit: All bets on vaccination rate
981," Don’t wait for Pfizer, get AZ now"
982, Confusion still reigns
983," Don’t wait for Pfizer, get AZ now"
984," Don’t wait for Pfizer, get AZ now"
985, TICKET TO FREEDOM
986, Vaccine push to pave way for reopening:   NATIONAL CABINET | EXCLUSIVE
987, Gladys Berejiklian and co must be held to account for this mess
988, Politics of vaccine sure to change
989, Fortress Australia plan to beat virus
990, New hope rules may ease up
991, Q & A WHAT YOU NEED TO KNOW
992, Q & A WHAT YOU NEED TO KNOW
993, Premier's road map a massive disappointment
994, Contact tracing a drag
995, Sutton hopes family visits can return if numbers dip
996, LETTERS TO THE EDITOR
997, Tech data shows how we curbed travel to flatten curve
998, Tech data shows how we curbed travel to flatten curve
999, Doing all we can ‘needs to be our priority’
1000, An emotional plea from the Northern Territory’s top doctor
1001, Early shot at extra freedom in balance
1002, Early shot at extra freedom in balance
1003, Hope at last after ‘pretty dark time’
1004, Hope at last after ‘pretty dark time’
1005, Herald Sun
1006," Target hit, so why hold back?"
1007," Target hit, so why hold back?"
1008, 'Research completely misrepresented to support a point'
1009, Barr calls out 'vicious' debate over reopening
1010, Barr calls out 'vicious' debate over reopening
1011, Budget $80bn better than tip
1012, Budget $80bn better than tip
1013, Budget $80bn better than tip
1014," Budget bottom line $80bn better than expected, but still in deficit"
1015, No fines for businesses letting in unvaxxed customers
1016, No fines for businesses letting in unvaxxed customers
1017, Our Three Stooges are nothing to laugh about
1018, Herald Sun
1019, Borders ‘stay shut until curbs lifted’
1020, Delta delay ‘to set economic recovery back by six months’
1021, VICS IN ISO WIN
1022, Reward for a jab done … one day
1023, Intensive care overhaul
1024, Revised 90% vax rate still on cards
1025, Revised 90% vax rate still on cards
1026, Revised 90% vax rate still on cards
1027, 'Doesn't really help us at all'
1028, 'Doesn't really help us at all'
1029, States told to keep 'medium' restrictions
1030, Restrictions in some spots urged even if target met
1031, Premiers unite on over-60s
1032, Dan and Gladys unite to reject over-60 Pfizer plan
1033, Open up at 80pc: Donato
1034, Shire Matters with Mark Speakman: Reopening NSW roadmap offers light at the end of the tunnel
1035, Hope on the horizon if we all do our bit
1036, Hope on the horizon if we all do our bit
1037, Herald Sun
1038, Donato calls for freedom at 80 per cent
1039, LETTERS TO THE EDITOR
1040, Claim 5800 lives saved
1041, Claim 5800 lives saved
1042, Claim 5800 lives saved
1043, Vaccine supply set for major shot in the arm
1044, It’s a jabs rate race to stall inevitable
1045, Hunt backs jabs for over-12s despite doubts:   exclusive
1046, Premier’s week of confusing messages
1047, Premier’s week of confusing messages
1048, SA backs national cabinet path out of lockdowns
1049, Premier’s alarm for children criticised
1050, Caution over national reopening plan
1051, Caution over national reopening plan
1052, WE NEED A PLAN
1053, Herald Sun
1054, WE NEED A PLAN
1055, Wellcamp quarantine facility 'a game of politics'
1056," Stick to plan to reopen, Frydenberg tells states:   EXCLUSIVE"
1057, Frydenberg warns states to stick to the plan to reopen:   exclusive
1058, THE LIMBO MUST END FOR SAKE OF NATION
1059, Wellcamp quarantine facility 'a game of politics'
1060, Younger teens to join the vaccination race
1061, Young teens soon to join vaccine race
1062, Young teens soon to join vaccine race
1063, Young teens soon to join vaccine race
1064, Young teens soon to join vaccine race
1065, Infection case spike hits record territory
1066, Infection case spike hits record territory
1067, Targets not clear enough: expert
1068," Political push heating up, but is it what voters want?"
1069, Heated debate might be just what we need
1070, Herald Sun
1071, VIC LAGGING IN JAB RACE
1072, NT News TIME TO END VACCINE UNCERTAINTY
1073, VIC LAGGING IN JAB RACE
1074, Cabinet refuses to back bosses ordering workers to get jab
1075, Pollies getting snappy
1076, Pollies getting snappy
1077, ‘We could hit 80pc by November’
1078, Opening up tougher than locking us down
1079, Opening up tougher than locking us down
1080, Road map a welcome dose of hope
1081, The 16.8m shots to freedom
1082, The 16.8m shots to freedom
1083, THE MOMENT OF TRUTH
1084, Hopes pinned on rate of 80pc
1085," Vax certificate likely by October, PM reveals"
1086, Weekend worriers
1087, Jabs to ramp up over 7 days
1088, Extra test shaping as border solution
1089, Extra test shaping as border solution
1090," No test, no fly to ease the pressure"
1091, Victoria's Models celebrates 25 years in business
1092, Victoria's Models celebrates 25 years in business
1093, Experts warn on 'tough' case targets
1094, Green power shocker
1095, Green power shocker
1096, Green power shocker
1097, Creating jobs out of $3b pay pain
1098, Lives versus the economy is a statistical calculation:   Comment
1099, Lives versus the economy is a statistical calculation:   Comment
1100, Vaccine surge delivers freedom for five million
1101, Freedom pushed forward
1102, COVID peak \weeks off' amid border rule disarray
1103, Huge change for Victoria-NSW border as state records 2179 new cases and six deaths
1104, Huge change for Victoria-NSW border as state records 2179 new cases and six deaths
1105, Victorian reopening plan on track despite surge in new Covid-19 cases
1106, Daily Telegraph editorial: End the eastern suburb’s cocaine culture
1107, IN-HOME FOR COVID XMAS
1108, IN-HOME FOR COVID XMAS
1109," Daily Telegraph editorial: Vaccin ation target hit, so why hold back?"
1110, Queensland Health Minister lashes Prime Minister Scott Morrison’s ‘unfair’ border roast
1111, LINES OF EVASION
1112, Vow to get Victoria open as Covid-19 cases rocket
1113, Vaccines begin to quell ICU numbers:   HOSPITALISATIONS PLATEAU
1114, 241 Victorians hospitalised with COVID-19 as Treasurer slams 'reprehensible' protestors
1115, Political lens key to states' varied paths to freedom
1116, Darkest days loom on path to 'normal':   Analysis
1117, Editorial: Don’t be surprised if 80 per cent suddenly becomes 90 per cent
1118, Even true libertarians can support vax passports
1119, COVID-infected health worker confirmed to have worked in Ballarat
1120, COVID facts under pressure: we need a reopening we can trust
1121, Backflip on aged care Covid plan
1122, COVID crunch for health system
1123, COVID crunch for health system
1124," It’s our daycare of reckoning as girl , 4, gets virus"
1125," It’s our daycare of reckoning as girl, 4, gets virus"
1126, Worsening COVID week as leaders argue over vaccination triggers to end lockdowns
1127, Palaszczuk ploy is just playing with numbers
1128, Queensland Premier says thousands will die each month if borders open
1129, Premiers quit Covid path out
1130, Premiers quit Covid path out
1131, Annastacia Palaszczuk may keep Queensland border closed until kids are jabbed
1132, Michaelia Cash: states border powers fall at 80 per cent vaccination
1133, Leaders still at odds on threshold
1134, Leaders still at odds on threshold
1135, National COVID plan could see state suffer
1136, Albanese gets the short end of stick from Bill
1137, In her words: Why the Premier is going it alone with the Wellcamp regional quarantine hub
1138, Covid will stick around: experts
1139, Palaszczuk stays cagey on the plan to open up
1140, Palaszczuk stays cagey on the plan to open up
1141, Pfizer doses welcomed
1142, 'Brakes are failing' on NSW's delta response
1143, Freedoms for fully vaccinated under national proposals
1144, A PLAN B FOR DELTA
1145, Brakes are failing on delta outbreak
1146, ‘This groundhog day has to end’: PM gets set for lockdown showdown
1147, Denying support to people in lockdown would be 'electoral suicide' for Coalition: Barr
1148, Denying support to people in lockdown would be 'electoral suicide' for Coalition: Barr
1149, Denying support to people in lockdown would be 'electoral suicide' for Coalition: Barr
1150, Denying support to people in lockdown would be 'electoral suicide' for Coalition: Barr
1151, Youth in Pole position
1152, Youth in Pole position
1153, COVID vaccines and kids: a complex equation
1154, Premier Daniel Andrews sets new vaccination target as 15 new cases emerge
1155, 15 new cases as South Melbourne Market named as Tier 1 site
1156, There's no defence for reckless reopening plan
1157, Mapping a road to recovery
1158, Mapping a road to recovery
1159," Agility, volatility and reality in the age of COVID"
1160," Agility, volatility and reality in the age of COVID"
1161, Path from lockdown hinges on vaccination
1162, Vaccinated get 'special' rules in PM's unified plan
1163, Coronavirus: More than 400 unaccompanied Australian children stranded overseas
1164, Patient figures to ease curbs
1165, Patient figures to ease curbs
1166, Scientists torn over whether city's lockdown is enough to tame Delta
1167, Scott Morrison’s bold lockdown claim that jab rollout will be done by Christmas
1168, Kids need the jab or we’re staying shut
1169, Game changer as kids in firing line
1170, Game changer as kids in firing line
1171, KIDS NEED THE JAB OR WE’RE STAYING SHUT
1172, The weight of the world
1173, Key target: immunity among elders:   Exclusive
1174, Six days straight without a local COVID case in Victoria
1175, Politics of vaccine sure to change
1176, Coronavi rus Australia live news: NSW Health admits ‘error’ over St Joseph’s College Pfizer jabs; NSW restrictions set to remain amid 18 new cases
1177, COVID roadmap in right direction
1178, Flu claim by Morrison disputed by experts
1179, Covid calm: Premier rebuffs lockdown calls
1180, Covid calm: Premier rebuffs lockdown calls
1181, Covid calm: Premier rebuffs lockdown calls
1182, Covid calm: Premier rebuffs lockdown calls
1183, Don't get distracted by vaccine delay blame games
1184," On track to reopen, but going too soon risks a third wave"
1185, Reasons to keep 5km rule challenged
1186," IF HOLLYWOOD AND SPORTS HEROES ARE GOOD TO FLY, THEN WHY CAN’T WE?"
1187, Regions poised to reopen in days
1188, THE MODEL BEHIND OUR ROAD TO RECOVERY
1189, State contact tracing last-minute digital reset:   exclusive
1190, Best guess not good enough any longer
1191, GUIDING LIGHT
1192, CSIRO ARMED NATION FOR INFECTIOUS INVADER
1193, OZ GOING THE DISTANCE
1194, OZ GOING THE DISTANCE
1195, RESURGENCE A REAL POSSIBILITY
1196, OZ GOING THE DISTANCE
1197, RESURGENCE A REAL POSSIBILITY
1198, Diabolical dilemma looms even after the curve is flattened:   THE CURVE
1199, It's time to loosen the blindfolds
1200," Ballarat records five new COVID cases, 'significant growth' elsewhere in regions"
1201, Keep calm and carry on as Covid-normal
1202, Keep calm and carry on as Covid-normal
1203, Queensland records two new local Covid cases overnight
1204, South-west Victorian students to return to classroom from next week
1205, THE FARCE AND THE FURIOUS
1206, Covid and borders: Peter Gutwein reveals what opening up will mean for Tassie
1207, Vaccinating children ‘to slash hospital rates’
1208, Vaccinating children ‘to slash hospital rates’
1209, Emergency call record raises health system alarm:   Exclusive
1210, Joyce and local doctors agree: Only vaccination can save the local health system
1211, Joyce and local doctors agree: Only vaccination can save the local health system
1212, Covid-19: NSW plots a scenario for unvaccinated to re-enter the economy
1213," Opinion: Don’t bank on open borders for Christmas, Palaszczuk won’t allow it"
1214, ICU needs overhaul to handle case surge
1215, Opening up can be difficult too
1216, Premier walks tightrope in agonising path to freedom:   Analysis
1217, Hotspot borders set to be reviewed:   exclusive
1218, Premier's gamble as NSW dices with deadly Delta
1219, What does code black mean for our hospitals?
1220, Vaccinations of children as young as five needed to achieve herd immunity: report
1221, Economy holding up but fiscal policy support still needed
1222, Children needed in vaccine rollout to achieve herd immunity: new research
1223, Children needed in vaccine rollout to achieve herd immunity: new research
1224, Children needed in vaccine rollout to achieve herd immunity: new research
1225, Children needed in vaccine rollout to achieve herd immunity: new research
1226, It’s a jabs rate race to stall inevitable
1227, Our confederacy of dunces
1228, PM spruiking partial truths
1229, Flaw and border for Anna
1230, We’re sick to death of Anna
1231," It’s more complex than that, PM"
1232," It’s more complex than that, PM"
1233, We’re sick to death of Anna
1234, NSW COVID-19 cases back above 1200 as 7 million jabs milestone hit
1235, NSW COVID-19 cases back above 1200 as 7 million jabs milestone hit
1236, LEADERS TOLD TO OPEN UP
1237, Pressure on Palaszczuk to open up
1238, Truckies took Covid through SA
1239, LEADERS TOLD TO OPEN UP
1240, Truckies took Covid through SA
1241, Why can't leaders agree on what a cautious reopening means for Australia?
1242, Why can't leaders agree on what a cautious reopening means for Australia?
1243, Premiers: time to lead us out
1244, Premiers: time to lead us out
1245, COVID 19: How sick are our kids getting and when can they be vaccinated?
1246, Palaszczuk stays cagey on the plan to open up
1247, Australia faces dire death toll if restrictions lifted at current targets
1248, Australia faces dire death toll if restrictions lifted at current targets
1249, Australia faces dire death toll if restrictions lifted at current targets
1250, How Delta variant impacts kids compared to adults
1251, Australia faces dire death toll if restrictions lifted at current targets
1252, Australia faces dire death toll if restrictions lifted at current targets
1253, Australia faces dire death toll if restrictions lifted at current targets
1254, Australia faces dire death toll if restrictions lifted at current targets
1255, PM vows to 'reinforce' hospitals out of lockdown
1256," Reopening Australia too early with lack of restrictions would cause ‘substantial mortality’, experts say"
1257, Case numbers 'not the whole story' as nation reopens: PM
1258, Case numbers 'not the whole story' as nation reopens: PM
1259, Case numbers 'not the whole story' as nation reopens: PM
1260, Case numbers 'not the whole story' as nation reopens: PM
1261, NSW good to go with 70% jab rate: PM:   EXCLUSIVE | REOPENING PLAN
1262, Andrews set to extend lockdown
1263," Covid-19 Australia: V ictoria faces new curfew, rules; NSW has 7 deaths, 478 cases"
1264, When Victoria will hit 70 per cent vaccination rate
1265, Covid normal demands big change of attitude
1266, Is cost of living with virus too high?
1267," Moment of truth, for us — and for Morrison"
1268, Path out is lined with big graphs
1269, Vaccination target a key to path out of lockdown
1270, Scientists split over Sydney's lockdown
1271," Vax thresholds set higher here than in US, UK"
1272, Why we should all be barracking for Sydney
1273, The secret death toll figure that left minister 'stunned':   Exclusive
1274," Jayden Moorea, Dan Shearin, Breeana Robinson: Gold Coast Titans cheerleader’s death leads to Southport committal hearing"
1275," Jayden Moorea, Dan Shearin, Breeana Robinson: Gold Coast Titans cheerleader’s death leads to Southport committal hearing – latest reports day six"
1276, Thousands feared close to mystery COVID case
1277, Mutant virus threat
1278, ‘Don’t rush vaccine’ for new strains
1279," ‘Don’t rush vaccine’ because of new strains, northern beaches outbreak"
1280, How medical science staved off calamity
1281, How medical science staved off calamity
1282, Experts run their eye over the road out of lockdown
1283, You should be wary of these catastrophes
1284, Beware catastrophisers
1285, We aren’t immune to facing a wicked choice
1286, The magic number that will allow intensive care units to cope
1287, The magic number that will allow intensive care units to cope
1288, The magic number that will allow intensive care units to cope
1289, The magic number that will allow intensive care units to cope
1290, COVID-19 case count remains unchanged
1291," Relaxing curbs risks 'explosive' outbreak, say experts"
1292, 'Explosive resurgence' if virus curbs relaxed
1293, Terrible choice looms even if curve flattens
1294," Money buys hope, but not trust"
1295, Tougher measures ‘a matter of life or death’
1296, Tougher measures ‘a matter of life or death’
1297, The prime minister is between a rock and a hard place
1298, The prime minister is between a rock and a hard place
1299, The prime minister is between a rock and a hard place
1300," Hold your nerve, PM tells divided leaders"
1301," Hold your nerve, PM tells divided leaders"
1302, Barr leads national cabinet push on childhood vaccines
1303, Deal for 1m more Pfizer doses 'just not enough': premiers
1304, Deal for 1m more Pfizer doses 'just not enough': premiers
1305, Vaccine hesitancy is rife among year 12s
1306, Vaccine hesitancy is rife among year 12s
1307, Data reveals the take up of vaccinations in the South Coast and Southern Highlands
1308, MORE WEEKEND JABS
1309, Half a vaccinated nation is enough for MPs
1310, LETTERS TO THE EDITOR
1311, TXT THE EDITOR
1312, ONCE BITTEN
1313, The great Australian buys
1314," Coronavirus: Victoria drops quarantine for vaccinated NSW, ACT arrivals"
1315, MP calls on Victorian government to release science behind roadmap
1316, MP calls on Victorian government to release science behind roadmap
1317," ‘Possible’ Victoria’s latest Covid wave has peaked, despite worst-case Burnet modelling"
1318," 1890 new Covid cases, five deaths; 10,000 fans allowed at Melbourne Cup"
1319," Victoria records 1838 cases, five deaths as Burnet Institute says high infections won’t impact lockdown exit"
1320," Victoria records 1838 cases, five deaths as Burnet Institute says high infections won’t impact lockdown exit"
1321, LNP’s complaint that Premier Annastacia Palaszczuk misled parliament on Covid modelling dismissed
1322, Andrew Bolt: Doom and gloom virus models holding Victorians hostage
1323, Burnet Institute refusing to return JobKeeper despite $60m surplus
1324," Covid-19: Queensland announces mandatory vaccinations for truckies, while Tweed-Byron lockdown to end at midnight"
1325," NSW road map out of lockdown compared to US, Denmark, UK"
1326, Covid-19 Qld: Premier requests modelling feds say she already has
1327, Questions raised over regional roadmap COVID modelling
1328, LNP want Premier probed by ethics committee over Doherty Institute modelling ‘misuse’
1329, Is reopening model right on hospitals?
1330, Doherty expert agrees Delta strain could push NSW hospitalisations higher than initially thought
1331, Qld Premier Annastacia Palaszczuk fires up at reporters questioning tough border stance
1332, Thousands of retired healthcare workers to return to the frontline as Covid ICU surge approaches
1333," Coronavirus: Non-Covid healthcare under stress, says AMA president Omar Khorshid"
1334, Models and road maps vary wildly as virus keeps us guessing
1335, Models and road maps vary wildly as virus keeps us guessing
1336," Modelling, road maps vary wildly as Covid-19 keeps us guessing"
1337, Covid modelling behind our roadmap out of lockdown explained
1338, National cabinet considers updated plan for Australia’s reopening with a major change
1339, Covid-19: Lockdown lobby OzSage proves misery loves company
1340, COVID models give different view of future
1341, 473 new Covid cases; vaccine blitz in construction industry
1342, NSW path from lockdown will be a bumpy ‘experiment’
1343, AMA says NSW reopening plan ignored warning in modelling
1344, AMA says NSW reopening plan ignored warning in modelling
1345, Burnet Institute’s Brendan Crabb says NSW likely to stay in lockdown until Christmas
1346, Hospitals prepare for surge in cases:   EMERGENCY MODELLING
1347, Shorten: southwest suburbs can’t be locked down while Mosman parties
1348, Coronavirus vaccine rates surging in Sydney hotspots
1349, Covid Qld: Boulevard Early Learning Centre and Windaroo State School closed after young girl tests positive to Covid-19
1350, Palaszczuk poisons reopening plan with faulty analysis of Doherty modelling
1351, Queensland Premier Annastacia Palaszczuk apologises for NRL WAGS flight
1352, Premiers quit agreed path out of coronavirus pandemic
1353, No new SA cases but 99 in quarantine linked to Covid-positive NSW truckies
1354, No new SA cases but 99 in quarantine linked to Covid-positive NSW truckies
1355," Coronavirus world: Aussie Wuhan bat scientist, Danielle Anderson, gives dire warning on virus origin"
1356, Our Covid mindset must change if we are ever to open up
1357, Doherty Institute numbers will test Australia's appetite for coronavirus death and illness
1358, New Stay At Home rules for grandparents in Victoria
1359," Open up, even if coronavirus cases are high: Doherty Institute modelling"
1360," Covid vaccine target: Sydney Uni modelling says 40,000 cases a day if we reopen too fast"
1361, Government to expand Covid-19 business support payments with Jobsaver
1362," Covid-19 updates: NSW has 1029 cases, Scott Morrison says kids will get vaccines soon as 18m get jabs"
1363, Tom Minear: Alarming Covid modelling divorced from reality
1364," 45 new cases, vaccine booking website buckles under rush of Pfizer bookings"
1365," Covid-19 ‘inevitable’ for states aiming for zero cases says Dr Paul Griffin, Doherty Institute"
1366," 45 new cases, vaccine booking website buckles under rush of Pfizer bookings"
1367," Covid-19 updates: NSW records worst day, travel bans avoided 48K cases in Australia"
1368, Previous mystery cases linked; change to jab eligibility; 50 new infections
1369, Tony Blakely: The five scenarios facing Victorians as Delta variant spreads
1370," Doherty Institute says no modelling predicts Covid-zero, but vaccination rates imperative"
1371," Doherty Institute says no modelling predicts Covid-zero, but vaccination rates imperative"
1372, Explained: New data modelling and why the states are freaking out
1373," Cops injured, use new weapon on bleakest day"
1374," Cops fire non-lethal rounds, scores arrested"
1375, How to stop spread of Covid-19 Delta variant: jab all teenagers
1376, Most workers support Covid-19 vaccination passports
1377, Coronavirus Australia live news: NSW peaks again with 633 cases: Vic records 24 new local cases; NZ situation worsens
1378," 22 new Covid cases; Melbourne curfew returns, lockdown extended for two weeks"
1379," Coronavirus Australia live news: NSW records 478 cases, 7 deaths; Melbourne’s curfew back with 22 new Vic cases; 19 cases in ACT, NT snap lockdowns"
1380, ‘Can I finish?’: Gladys Berejiklian fires up over zero covid in NSW
1381," 22 new Covid cases; Melbourne curfew returns, lockdown extended for two weeks"
1382," Coronavirus Australia live news: NSW clocks up five million jabs amid 415 new cases, four deaths; PM secures additional Pfizer from Poland; 25 new cases in Victoria"
1383, Adapting to uncertainty can conjure a new sense of order
1384, Taking vaccines straight into Covid-19 areas the ‘circuit breaker’ Sydney needs
1385, D-Day for Delta: Spike in Victoria’s Covid case numbers as 29 new infections recorded
1386, All the ways Covid has changed us culturally
1387," Coronavirus Australia live news: mRNA vaccines available to under 40s by next month, Lieutenant-General John Frewen says"
1388," Coronavirus: Under 40s, peak transmitters of Delta strain, shifted to vaccination fast track"
1389, Calls for fresh insight into lockdown triggers as Victoria records four new cases
1390, Southwest Sydney and far west NSW have lowest vaccine rates in the state
1391," Four new cases in Victoria, Labor promises $300 windfall for fully vaccinated Australians"
1392, Coronavirus live news Australia: Delta-day for southeast Queensland as more schools alerted; NSW Police deter protesters; NRL and AFL reschedule matches
1393, Magic vaccine number that will end Australia’s lockdowns
1394, Coronavirus Australia live news: 70 per cent vaccination needed to limit lockdowns
1395, Young drive massive push for AstraZeneca jabs
1396, Greek on Halifax chef forced into hotel quarantine despite not having coronavirus
1397, Data modelling shows Sydney lockdown could stretch until September
1398," Coronavirus: Only 40pc of Sydney people staying at home, modelling says"
1399, New modelling from Burnet Institute suggests stronger Sydney measures are needed
1400, Modelling plots best path to opening up and living with the coronavirus
1401, Covid-19 vaccine targets to unlock the path to freedom
1402, Coronavirus calm: NSW Premier Gladys Berejiklian rebuffs Covid lockdown calls
1403, Vaccine hesitancy could lead to thousands of deaths if virus was ‘left to run’
1404, Victoria lobbying for UK ban in attempt to stop mutant strain escaping hotel quarantine
1405," Coronavirus Australia live news: SCG Test crowd cut, 63 Sydney suburbs on alert amid fears of Covid spread"
1406," ‘Don’t rush coronavirus vaccine’ because of new strains, northern beaches outbreak, says expert"
1407, Modelling under fire amid low death toll:   Infection rates
1408, Murphy defends early coronavirus modelling
1409, Murphy defends early coronavirus modelling
1410, Murphy defends early coronavirus modelling
1411, Murphy defends early coronavirus modelling
1412, True infection count 'far higher than official tally':   modelling
1413, Warning on effects of lifting restrictions:   modelling
