,0
1414, Why a European-style summer is not in the COVID picture for us just yet
1415, Why a European-style summer is not in the COVID picture for us just yet
1416, Why reopening Tasmania will be the most costly challenge yet
1417, Calm down? Queenslanders sick of leaders’ excuses
1418, Calm down? Queenslanders sick of leaders’ excuses
1419, Calm down? Queenslanders sick of leaders’ excuses
1420, Calm down? Queenslanders sick of leaders’ excuses
1421, Get ready for when we let Delta into the state
1422, Covid Qld: Latest case numbers as government insiders say next 24 hours to determine lockdown situation
1423, Time is right for a fresh challenge on state borders
1424, DELTA THREAT RIPS HEART OUT
1425, Pandemic pressure: Can NSW rural and regional health cope?
1426," High death rate likely with reopening plan, Premier says"
1427, Pandemic pressure: Can NSW rural and regional health cope?
1428, System under stress
1429, System under stress
1430, System under stress
1431, System under stress
1432, Vaccinated youth key to Covid-19 freedom
1433, System under stress
1434, System under stress
1435, Locked-down and out in Dan’s penal pandemic paradise
1436, Uncivil war a disaster of Premier’s making
1437, System under stress
1438, System under stress
1439, System under stress
1440, Pandemic pressure: Can NSW rural and regional health cope?
1441, Pandemic pressure: Can NSW rural and regional health cope?
1442, Ballarat hits 50% fully-vaccinated benchmark
1443, A rocky path towards reopening
1444," Covid Qld: No new community cases recorded, border bubble bursts"
1445, Pathway to reopening is clear
1446, Death rates near lowest: Hunt
1447, Call for all COVID rules to go when city is 80 per cent fully dosed
1448, Call for all COVID rules to go when city is 80 per cent fully dosed
1449, Experts weigh risk of double-dose freedoms:   Analysis
1450, Borders must open for fully jabbed: experts
1451, COVID plan lays out a cautious path to freedom
1452," Covid-19: Hold your nerve, Scott Morrison tells divided leaders"
1453, Politicians got a fair bit right on Covid-19 as journalists split on party lines
1454, Labor in a bind as it grapples with how to support a reopening:   ANALYSIS
1455, UK Pfizer deal to speed up jab rates
1456, The transition to living with 'endemic' COVID could be rough
1457, The transition to living with 'endemic' COVID could be rough
1458, Covid Qld: Premier’s regrettable week could have been avoided with an early apology
1459, CHO Jeannette Young explodes at question on level of Covid deaths she would be ‘comfortable with’
1460, PREMIER’S FAKE NEWS
1461," Qld records new virus case, family unwell"
1462, Partisan squabbling not helping virus fight
1463, Political squabbles mask larger reality of life with virus
1464, Federal fury at 'scaremongering'
1465, Federal fury at Qld 'scaremongering'
1466, We deserve a better plan
1467, 'They're winging it': Indigenous communities left behind in Covid outbreak
1468, ‘Coasters should have hope’
1469, Reinvigorated PM turns the tables on recalcitrant premiers
1470, 'They're winging it': Indigenous communities left behind in Covid outbreak
1471, 'They're winging it': Indigenous communities left behind in Covid outbreak
1472," Parents, don't panic about Delta"
1473, Reinvigorated Scott Morrison turns the tables on recalcitrant premiers
1474, Delta hits young less
1475, Delta hits young less
1476, Jeannette Young says masks could stay even as other Covid-19 rules are relaxed
1477, Easing of border restrictions now up in the air as QLD Government strives to keep Covid out
1478," Coalition's story shift political, not epidemiological:   The Herald's View"
1479, Suppression still vital in virus exit strategy:   The Age's View
1480," 'Lockdown is working': ACT records eight new Covid cases, all in isolation"
1481," 'Lockdown is working': ACT records eight new Covid cases, all in isolation"
1482," 'Lockdown is working': ACT records eight new Covid cases, all in isolation"
1483, PM backs NSW on opening up
1484, Vaccines vital but they won't solve everything
1485, Top End ponders kid care strategy
1486, Top End ponders kid care strategy
1487, Business anger as state goes it alone on borders
1488, Business anger as state goes it alone on borders
1489, Covid-19 Australia: Health Minister Greg Hunt admits lockdowns could remain even if we hit vaccination target
1490, Bosses vital to attain vaccination surge:   'DELTA HAS MOVED THE NEEDLE'
1491, Ex-adviser to Biden urges jab mandates
1492, Our resilience has silenced Covid prophets of doom
1493," Improvement still needed for clear, consistent COVID-19 vaccine communication: AMA"
1494," Improvement still needed for clear, consistent COVID-19 vaccine communication: AMA"
1495," Improvement still needed for clear, consistent COVID-19 vaccine communication: AMA"
1496, Vaccination key to ending lockdowns
1497, The health advice: a sword and shield for needling doubt
1498, Even Gladystan is not immune from hysterics
1499," Rural Notebook | Year of COVID, trade wars and harvest joy"
1500," Rural Notebook | Year of COVID, trade wars and harvest joy"
1501," Rural Notebook | Year of COVID, trade wars and harvest joy"
1502," Rural Notebook | Year of COVID, trade wars and harvest joy"
1503, GRAND FINAL GOAL IN SIGHTS
1504, GRAND FINAL GOAL IN SIGHTS
1505," We're past peak of virus wave, say experts"
1506, Contact tracing delays prove costly
1507, Why the second campaign hasn't flattened the curve
1508, Why hasn't the curve flattened?
1509, What would a second wave look like?
1510, Schools should be first to reopen
1511, Schools should be first to reopen
1512, Push now to let virus infect all
1513, Health experts call for mass testing
1514, Andrews to reveal extra freedoms in updated plan
1515, Caution over open borders
1516, Opening borders a fraught exercise
1517, What QLD already knows about its Delta surge hospital capacity
1518," Gold Coast surf clubs, parks, cafes named as new exposure sites after case visits Kirra, Tweed Heads"
1519, Vow to get this place open as cases rocket
1520, Vow to get this place open as cases rocket
1521, LNP GRIPE DISMISSED
1522, LNP GRIPE DISMISSED
1523, LNP GRIPE DISMISSED
1524, State on edge as lockdown looms
1525, State on edge as lockdown looms
1526, State on edge as lockdown looms
1527, State on edge as lockdown looms
1528, Epidemiologists reveal when Victoria’s case numbers peak
1529, State plots a scenario for unvaccinated to re-enter the economy
1530, Staffing tight as hospitals brace for hit
1531, Road map gives hope and pause for thought
1532, Victoria hanging on vaccinations
1533, CREDLIN CALLS IT RIGHT ON GLADYS
1534," Dan’s day, but devil in detail for ScoMo"
1535, Hard road ahead as hopes take hit
1536, Hard road ahead as hopes take hit
1537, Why we have to get to 90 per cent
1538, Disability advocates say jab rate must rise
1539, Why this Delta outbreak got away
1540," A great path to freedom, so long as you're vaccinated"
1541, Federal and state leaders contradict NSW premier on national plan
1542, Federal and state leaders contradict NSW premier on national plan
1543, Trust the science and get vaccinated now
1544," Fear, suspicion add to stress of aiding nation's most vulnerable"
1545, Race to find new contacts
1546, PREMIER’S FAKE NEWS
1547, PREMIER’S FAKE NEWS
1548, PREMIER’S FAKE NEWS
1549, Treasurer lashes Qld premier
1550, Treasurer lashes Qld premier
1551, Treasurer lashes Qld premier
1552, Treasurer lashes Qld premier
1553, Treasurer lashes Qld premier
1554, Treasurer lashes Qld premier
1555, Treasurer lashes Qld premier
1556, Treasurer lashes Qld premier
1557, HIDING BEHIND THE CHILDREN
1558, HIDING BEHIND THE CHILDREN
1559, Our interstate solidarity has finally snapped. It's a vaccine target free-for-all
1560, Our interstate solidarity has finally snapped. It's a vaccine target free-for-all
1561, Two die as state plots path out of lockdown
1562, High cases no limit to reopening
1563, Victorians asked to 'make best choices'
1564, Problems not over when we get to 80pc
1565, Why Freedom Day is a fiction
1566, Why Freedom Day is a fiction
1567, Herald Sun
1568, NSW surge threatens Victoria's zero target
1569, Premiers’ conflicting strategies will lead to a nation in chaos
1570, Premiers’ conflicting strategies will lead to a nation in chaos
1571, Contact tracers here to stay as we learn to live with virus
1572, Contact tracers here to stay as we learn to live with virus
1573, Contact tracers here to stay as we learn to live with virus
1574, Contact tracers here to stay as we learn to live with virus
1575, Sunday Mail Editorial We all need to be part of solution
1576, Top doc praises reaction to Delta
1577, Warning more lockdowns loom
1578, Jab parents to protect children: expert
1579, Fate of kids lies with vaccinated parents
1580, Fate of kids lies with vaccinated parents
1581, ‘Let it rip’ would kill thousands
1582, ‘Let it rip’ would kill thousands
1583, ‘Let it rip’ would kill thousands
1584, Border rules tighten in staged path to freedom
1585, Gladys and Co must be held to account for mess
1586, New regulations for south-west could come into force today
1587, Jury out on case number trajectory
1588, Lockdowns ‘can stop in two months’
1589, Lockdowns ‘can stop in two months’
1590, Shots in the dark
1591, No easing of restrictions despite key milestone
1592, Doctors question travel curb benefits
1593, Doctors question travel curb benefits
1594, Where to now for Melbourne?
1595, State must wait for freedom
1596, State must wait for freedom
1597, State must wait for freedom
1598, City could be given early mark
1599, City could be given early mark
1600," Targets for reopening flexible, says Andrews"
1601," Relying on the experts works, but only up to a point"
1602," Relying on the experts works, but only up to a point"
1603, When will the numbers come down?
1604, Full Stop
1605, Local figures likely off by an 'order of magnitude'
1606, THERE’S NOTHING TO FEAR FROM CONTACT-TRACING APP
1607, THE KEYS TO RESTART THE NATION’S ENGINE
1608, THE KEYS TO RESTART THE NATION’S ENGINE
1609, Next month the clincher
1610, BANS COULD EASE IN MONTH
1611, FOUR WEEKS TO FLICK SWITCH
1612, Lucky country must decide: what's our least-worst option?
1613, People v virus: knowledge is power
1614," 1903 new Covid cases, seven deaths; big change to home quarantine"
1615, Modelling gets NSW Covid-19 hospitalisations peak wrong
1616," Modelling, data: how outbreak is tracking"
1617, Julie Collins launches fresh call for $300 vacci nation payment
1618, Modelling institute’s job cash in doubt
1619, Modelling institute’s job cash in doubt
1620, Victorian paramedics under ‘huge stress’ with highest number of triple-0 calls in years
1621, Vaccinating kids ‘would slash hospitalisations’
1622, Coronavirus: Victoria’s health system is under siege
1623, Jabs prove modelling pessimists wrong
1624, Jabs prove modelling pessimists wrong
1625, Jabs prove modelling pessimists wrong
1626, Vaccination uptake proves modelling pessimists wrong
1627, How exposure site quarantine rules could be relaxed
1628, Gold Coast Covid border reopening: Dramatic changes needed for tourism industry to survive
1629, Missing modelling: Victoria's regional roadmap lacking evidence
1630, Missing modelling: Victoria's regional roadmap lacking evidence
1631, Missing modelling: Victoria's regional roadmap lacking evidence
1632, Coronavirus: Premier Annastacia Palaszczuk casts doubt on opening Queensland borders
1633, Delta death risk higher than exit plan models
1634, Doherty says restrictions shouldn't ease until 80pc vaxxed in some places
1635, Opening up can be difficult too
1636, Residents in three Victorian regions spend first day of what they hope is their last lockdown
1637, Gold Coast Covid border reopening: Anna Palaszczuk dithers
1638," Lock, shock and smoking quarrels"
1639," 567 new cases, major restrictions to remain in Victoria even after 80pc jab target is hit"
1640, Covid-19: Dan’s day but ScoMo’s big warning
1641," Prepare for worse as we reopen, warn premiers Daniel Andrews and Gladys Berejiklian"
1642, Covid Australia: Push for 90% vaccination rate to prevent deaths
1643, Victoria hits 70 per cent first dose vaccination target as state records 510 new cases
1644," Modelling shows thousands of deaths at 80 % vax, including children as experts push for 90% vax rate"
1645," Opening plan 'will fill ICUs, kill hundreds'"
1646, ICUs fear in NSW reopening
1647, Models diverge on life and death after lifting lockdown
1648," Home tests key in COVID battle, Doherty director"
1649, Victorian pub says it will let unvaccinated in once restrictions ease
1650," NSW Covid Updates: Vaccines and lockdown saved 5000 lives, data reveals"
1651, Anna’s cold reply to border heartache after families reunite on Father’s Day
1652, Covid-19: Gladys Berejiklian releases modelling on expected ICU numbers
1653," The Doherty Report: here, for you"
1654," The Doherty Report: here, for you"
1655, Covid Qld: Premier Annastacia Palaszczuk’s stance ‘damaging public confidence’
1656," Coronavirus: Annastacia Palaszczuk pushes for delta data on children, Gladys Berejiklian urges leaders to follow national plan"
1657," Covid Qld: No need to wait for children to be vaccinated, say experts"
1658, Spike in Victoria’s coronavirus figures as crowds hit the beach to enjoy the spring sunshine
1659, Leaders still at odds on Covid-19 vaccine threshold
1660," 73 new cases, Dandenong Hospital added to exposure site list"
1661, Campbell Newman’s sky-high support for border protests
1662," Covid Qld: Queensland records four new cases, no local transmission"
1663, Regional sports finals cancelled as SA Health names four possible exposure sites linked to Covid positive NSW truckies en route to WA
1664, ‘Too early’ to guess lockdown end date as 79 new Covid cases recorded
1665, New rules to crack down on Victorian border as 79 new Covid cases recorded
1666, Pressure on Scott Morrison to include teens in vaccine threshold modelling
1667, Belated campaign of hope arrives for our Covid future
1668, Covid Qld: Premier refuses to confirm whether interstate Christmas trips will be possible amid doubt over Doherty plan
1669, NSW Chief Health Officer Kerry Chant warns mask restriction could be in place ‘for years’
1670, NSW Chief Health Officer Kerry Chant warns mask restriction could be in place ‘for years’
1671," Reopening Australia too early with lack of restrictions would cause ‘substantial mortality’, experts say"
1672, Gladys Berejiklian warns premiers Delta will hit all states
1673, Covid-19 surge no threat to vaccine goal: Paul Kelly
1674," 71 new cases, slim hope Victoria’s lockdown will end on time"
1675," Coronavirus Australia live news: CMO says no need for revamp of reopening plan, NSW records 830 cases; ACT records 19 cases; Victoria 65 new cases"
1676, Northern Territory ponders children Covid-19 care strategy
1677," Qld to get 139,000 Pfizer shots from Australia’s 1m dose deal with Poland"
1678, Coronavirus Australia live news: Victoria opens first drive-thru vaccine clinic; NSW records 262 new cases
1679, Warning lockdowns to be more f requent
1680, Politicians have abdicated responsibility for this Covid crisis
1681, Flight Centre boss Graham ‘Skroo’ Turner: The prices we must pay for Covid freedom
1682, Al-Taqwa C ollege teacher tests positive to coronavirus after state’s first recent doughnut day dashed
1683, How Australia could be free of lockdowns by summer
1684, War over percentage who need to be vaccinated to stop Covid
1685, Coronavirus Australia live news: Stadium carparks to be drive-through jab hubs
1686," Coronavirus Australia live news: ADF troops hit Sydney streets, NSW records 207 local cases, Qld lockdown extended with 13 new cases"
1687, Coronavirus: NSW in ‘five-week race to freedom’
1688, Scott Morrison sets a goal of 16.8m shots to Covid-19 freedom
1689, Jab target is 70 per cent: researchers
1690, IT’S TIME FOR JAB RACE TO REV UP
1691, Jab target is 70 per cent: researchers
1692, IT’S TIME FOR JAB RACE TO REV UP
1693, Jab target is 70 per cent: researchers
1694, Sydney’s lockdown not hard enough to protect Victoria as state implements hard border with NSW
1695," Coronavirus Australia live news: New lockdown for Orange; SA locks down, Victoria’s lockdown extended another week, NSW records 78 new cases"
1696, Coronavirus Australia live news: New venue alerts as Sydney lockdown extended
1697," Coronavirus live news Australia: Police crack down on Sydney breaches; rush for second AstraZeneca doses; Qantas alert as passenger tests positive; 50 new cases in NSW, teen in ICU"
1698, Modelling paves best path to opening up
1699, Modelling paves best path to opening up
1700, Modelling paves best path to opening up
1701, Lockdowns ‘can stop in two months’ when Covid-19 vaccines hit 30pc
1702, Epidemiologist Tony Blakely says children should be vaccinated against Covid
1703, Modelling indicates why NZ got it right with bold call
1704, How we beat covid
1705, Coronavirus Australia live news: Covid alert for fortnight of F45 classes in Sydney
1706, Low blow: Covid goal too hard
1707, Low blow: Covid goal too hard
1708, Debate over coronavirus death predictions
1709, RAPID RESPONSE
1710, Modelling shows dangers if virus allowed to run without controls
1711, Modelling shows dangers if virus allowed to run without controls
1712, Modelling shows dangers if virus allowed to run without controls
1713, 'A matter of trust': Experts demand to see modelling
