,0
0, Modelling gets the peak wrong
1, Covid-19 Qld: Endless roadblocks to state joining national plan
2, Model behaviour
3, Model behaviour
4, Model behaviour
5, Media Watch Dog: AFR Magazine’s Power issue is in need of a re-set
6, What happens if Victoria’s hospitals are overrun with Covid patients
7, Premier urged to stick to the national reopening Covid plan
8, Modelling tips 100 state virus deaths
9, Victoria’s Covid Delta peak to hit higher number than NSW
10, Victoria's COVID cases surge past NSW's
11, Pauline Hanson says she hasn’t been able to see long-term partner for months due to border closures
12, Pauline Hanson says she hasn’t been able to see long-term partner for months due to border closures
13, Mask restriction eased as Qld records zero new local Covid cases
14, Pandemic election a tricky affair
15," More data needed on kids’ Covid-19 jabs, say doctors"
16, Premier looks to defy ‘worst case’ modelling
17, Hospitals to be 'under stress' as death rate tipped to soar
18, On a rollercoaster to Christmas
19, Daniel Premier looks to defy ‘worst case’ modelling
20, Prepare for worse as we reopen: premiers
21, Prepare for worse as we reopen: premiers
22, Modelling shows cases peaked last week
23, Modelling shows cases peaked last week
24, Rule-breach school hit by COVID outbreak:   Exclusive
25, Covid histrionics gone to the dogs
26, We have become the most divided country in the world
27," Jane Halton says NSW has ‘greater need’ for vaccines as Qld, WA lag behind"
28, Covid-19: Scott Morrison mission to accelerate freedom plans for vaccinated
29, What Dan Andrews needs to reopen Victorian schools
30, James Campbell: Covid politics will decide elections for state premiers
31, Bracing for Delta
32, ‘MISLEADING’ FROM FRONT
33, Why October will be NSW's 'worst month' as Covid cases soar
34, Private hospitals plan for Covid-19 wave
35, Covid-19: Lagging states widen the divide before border reopening
36," It’s more complex than that, Scott Morrison"
37, Covid-19 updates: NSW records 1288 cases; Grim warning for Victoria as virus outbreak grows
38, NSW outbreak puts strain on Doherty assumption: Barr
39, NSW outbreak puts strain on Doherty assumption: Barr
40, Our Covid mindset must change if we are ever to open up
41, Opening up with the virus
42," Premier Steven Marshall charts SA’s plans to reopen once vaccination targets are reached, flags targeted border closures"
43, Covid-19 vaccine rollout: Younger teens eligible for Pfizer ‘by end of the year’
44," Coronavirus Australia live news: Children aged 12-15 join vaccine rollout, NSW records 882 cases with schools to reopen on October 25"
45," Covid-19 updates: Premiers urged to re-open even if cases high, Seven’s Sunrise has Covid scare"
46, Covid-19 vaccination rates around the world
47, Anthony Albanese left exposed by Labor Covid-zero strategy zealots
48, It's establishing the strategy for managing COVID that matters:   Analysis
49, PM’s team stakes all on reopening gambit
50, Losing hope: Premier lashed for blocking path to freedom
51, Anthony Albanese in danger of playing losing hand on Covid-19 vaccines
52," ACT hits ‘record day’ for Covid-19 cases, with 30 new infections"
53, ‘We haven’t given up’: Queensland Premier Palaszczuk’s swipe at NSW’s handling of Delta outbreak
54, ‘We haven’t given up’: Queensland Premier Palaszczuk’s swipe at NSW’s handling of Delta outbreak
55, NSW contact tracing teams ‘have lost the battle with Delta’ variant of Covid-19
56," Covid-19 updates: Scott Morrison calls on states, territories to stick to vaccine agreement to open up"
57," Covid-19 updates: Scott Morrison calls on states, territories to stick to vaccine agreement to open up"
58, Queensland-NSW border might not open even if NSW reaches 80 per cent vaccination rate
59, Scott Morrison urges states to stick to deal on Covid-19 lockdowns
60," Coronavirus Australia live news: NSW records 644 new cases, 4 deaths as Sydney lockdown extended; Victoria records 55 new local cases"
61," Victorian Premier Daniel Andrews says Covid-19 vaccination, testing ‘best way forward’"
62, Annastacia Palaszczuk tight-lipped on Covid strategy once Queensland reaches vaccination target
63, NSW crisis risks hopes of opening the nation
64, Bosses flag return to work in NSW for the Covid-19 vaccinated
65, Coronavirus Australia live news: Victoria opens first drive-thru vaccine clinic; NSW records 262 new cases
66, Victoria enters its sixth lockdown
67, Tom Minear: ScoMo must give us a clear vision for living with Covid
68, Covid in Australia: Wild clashes as Victoria is thrust into sixth lockdown
69, AstraZeneca chief Pascal Soriot lists Lavender Bay house amid Covid-19 lockdown
70," Covid deaths will be inevitable when we open up, so we need to tackle the topic now"
71, How Australia could be free of lockdowns by summer
72, Achieving vaccination 80 per cent rate won’t be end of restrictions
73, 50 per cent vaxxed is not enough to safely lift restrictions: Doherty Institute
74, Our resilience has silenced Covid prophets of doom
75," Repco, McDonald’s, bus routes amon g new exposure sites identified in Sydney"
76, Australia to hit next phase of Covid recovery when 70 per cent vaccinated
77, Targeted Covid-19 lockdowns ‘to run into new year’
78, Covid-19 Australia: Scott Morrison reveals vaccination targets to get out of lockdown
79, ‘We’re still on track for return to normal’: Morriso n
80, Covid-19 vaccine thresholds set higher here than in US and UK
81, Coronavirus Australia live news: 600 health workers in isolation in Sydney
82, Covid-19: Half a vaccinated nation is enough for MPs
83, Coronavirus Australia live news: Brisbane still masked despite lockdown end; ‘Green shoots’ in NSW
84, Modelling indicates why NZ got it right with bold call
85, Modelling indicates why NZ got it right with bold call
86, Modelling indicates why NZ got it right with bold call
87, Southeast QLD school captains of 2021 reveal plans for 2021
88, Southeast QLD school captains of 2021 reveal plans for 2021
89," Saint, Sinner, Shoosh: Supercars pornstar Renee Gracie goes viral in new ad"
90," Saint, Sinner, Shoosh: Ricky Stuart hosts his English players on Christmas Day"
91," Saint, Sinner, Shoosh: Latrell Mitchell’s boost for Rabbitohs"
92, ’Don’t rush vaccine’: COVID-19 vaccine warning as NSW records nine new cases
93, Rolling coverage: Victoria could be free of virus for months
94, Elimination: How Victoria made it
95, TARGETS CAN BE FLEXIBLE
96, RUNNING OUT OF OPTIONS
97, Beware letting inexact science of modelling drive policy
98," Sound policies in place, so now it’s in our hands, people"
99," Sound policies in place, so now it’s in our hands, people"
100, Border bashing reaches new low
101, Border bashing reaches new low
102, Event organisers welcome pass plan
103," Fear over cancer, cardiac deaths"
104," Fear over cancer, cardiac deaths"
105, Nurses have 'nervous anticipation' over borders reopening
106, Is our health system ready for re-opening?
107, We need to work together to recover our freedoms
108, bordermail.com.au comments
109, 'There's a chance he'll die'
110," Drip-feeding our rights is so very, very wrong"
111, OPEN UP AT 80 OR FACE AN ‘ABYSS’
112, Susie O’Brien: Construction workers should walk a mile in our kids’ shoes
113, Good leadership is guiding the way out of pandemic
114, Economy holding up but support still needed
115," For the premiers playing politics of fear, the game’s up"
116, Herald Sun
117," For the premiers playing politics of fear, the game’s up"
118, The hits and misses in national cabinet
119, Victoria's sacrifices are not in vain:   Comment
120, Letters to the Editor
121, Letters to the Editor
122," Rotting, stinking, and nothing's being done"
123," Don’t look now, it’s our worst day"
124," Don’t look, it’s getting worse"
125," Don’t look, it’s getting worse"
126," Don’t look, it’s getting worse"
127, Berejiklian must reveal plan to reopen economy:   The Herald's View
128, PUPILS ANSWER VAX ROLL CALL
129, Albanese gets short end of stick from Bill
130, PUPILS ANSWER VAX ROLL CALL
131, Dire predictions are not helpful
132, PM’s bold gamble could lock in the election
133, Sticking to a unified plan for the common good
134, Freedoms for fully vaccinated under national proposals
135, Freedoms for fully vaccinated under national proposals
136, Freedoms for fully vaccinated under national proposals
137, SHOWDOWN AS PM TAKES ON STATES
138, Premier refuses to divulge plans for post-jab-target restrictions
139, SHOWDOWN AS PM TAKES ON STATES
140, SHOWDOWN AS PM TAKES ON STATES
141, Kelly joins Palmer party for access to war chest
142, Chief Medical Officer’s hint on when Australia can reopen
143, PM urges states to stick to deal on lockdowns
144, PM urges states to stick to deal on lockdowns
145, Experts face battle to keep areas on target
146, Focus will be on key areas in bid to reach 70% vaccination level
147, Overnight success or overreach: Views divided on curfew
148, No clarity on opening up state with 80pc coverage
149, No clarity on opening up state with 80pc coverage
150, No clarity on opening up state with 80pc coverage
151, Tweed border: Major Gold Coast school loses 28 teachers to tough NSW border restrictions.
152, Let’s embrace uncertainty to make sense of these times
153, Letters to the Editor
154, Locking in a bleak few months
155, Locking in a bleak few months
156, Who decides what's too dangerous to hear?
157, Top doc praises reaction to Delta
158, HOW WE CAN BE OPEN BY CHRISTMAS
159, DELTA A SWORD ABOVE OUR HEADS
160, Giving AstraZeneca another chance
161, Giving AstraZeneca another chance
162, Why attention is turning to vaccinating the under 40s
163, State’s five-week race to freedom
164, State’s five-week race to freedom
165, State’s five-week race to freedom
166, Race is on to get the jab done
167, Race is on to get the jab done
168, States hold keys to freedom as business pushes premiers to honour national cabinet deal
169, States hold keys to freedom
170, States hold key to freedom
171, FOUR-PHASE PLAN’S OUR ONLY SHOT OUT OF THIS
172, FOUR-PHASE PLAN’S OUR ONLY SHOT OUT OF THIS
173, Australia's new 'return to normal' plan
174, Roadmap aimed at restoring confidence
175, Australia's new 'return to normal' plan
176, Australia's new 'return to normal' plan
177, Roadmap aimed at restoring confidence
178, Australia's new 'return to normal' plan
179, Roadmap aimed at restoring confidence
180, Australia's new 'return to normal' plan
181, 2000 jab doses at risk after outage
182, LETTERS TO THE EDITOR
183, LETTERS TO THE EDITOR
184, QLD in a truly troppo call for cash
185, Zeroing in on Victoria's success in suppression
186, NEW HOPE CAN’T MASK OUR RELIEF
187, $1 billion council merger failures:   Exclusive
188, State's contact tracing to face its biggest test
189, City in battle to reach target
190, 'On track for 30 cases a day'
191, Panic Room
192, 'On track for 30 cases a day'
193, Virus bans ease amid fears of new wave
194, Police state driven by overreaction and alarmism
195, You should be wary of these catastrophisers
196," Gyms, nightclubs could be last in line:   REOPENING"
197, Why we invest in medical research
198, Tent city rises to treat patients who’ve tested positive
199, Tent city rises to treat patients who’ve tested positive
200, The end of months of needless uncertainty
201, The end of months of needless uncertainty
202, Canberra reaches 80% vaccination threshold
203, A big step on path back to normality:   The Age's View
204, Hesitancy rates dropping but reluctant few still need persuading
205, NSW in pole position to avoid case surge
206," Congratulations, Canberra, on reaching a 70% fully vaccinated rate"
207," Congratulations, Canberra, on reaching a 70% fully vaccinated rate"
208, PAVING THE WAY FOR MORE FREEDOM
209, Surge may delay the plateauing of numbers
210, South-west students return to classroom
211, Uniting a divided cabinet
212, Uniting a divided cabinet
213, Child dies after family on hold to triple zero
214, Child dies after family on hold to triple zero
215, The uncertainty of the pandemic persists
216, Delta delay ‘to set economic recovery back by six months’
217, Delta delay ‘to set economic recovery back by six months’
218, Delta delay ‘to set economic recovery back by six months’
219, Pfizer supply concerns
220," Vaccine mandate set for major events, hospitality"
221, Doctors in Australia’s under-pressure health care system face an additional challenge
222, XMAS QUARANTINE TO REMAIN ON THE CARDS
223, Regional release on cards
224, Teenage jabs 'key to immunity'
225, Geelong edging towards more freedoms this week amid promising regional figures
226, A NEW TWIST IN VIRUS POLITICS
227, PANDEMIC POLITICS TAKE ANOTHER TURN
228, Writing’s on (border) wall for hermit states
229, A NEW TWIST IN VIRUS POLITICS
230, We got it wrong on NRL arrivals: Premier
231, Home tests the key to getting our kids back to school sooner
232, Premier living in state of ‘denial’
233, Albanese goes cold on Premier’s push
234, Kids can come home
235, Letters: Consider needs of students when delaying HSC exams
236, We need clarity on future
237, We need clarity on future
238, We need clarity on future
239, Younger teens eligible for Pfizer ‘by end of the year’
240, Why kids are more likely to get Delta
241, Vax rate key to borders reopening
242, Premier’s plan leaves Albanese in a bind
243, Vic aged care centres to get rapid tests
244, Vic aged care centres to get rapid tests
245, PM’s team stakes all on reopening gambit
246, Health Minister says we will rely on own advice before reopening
247, Waiting for Pfizer? The 'boomer' vaccine delay could prove catastrophic
248," Masks on all round, political gloves come off"
249, Nation must not 'fear' reopening: Prime Minister
250, Nation must not 'fear' reopening: Prime Minister
251," PM insists he is right, so should reveal more:   Analysis"
252, RMH cluster fears
253, RMH CLUSTER FEARS
254, Business leader backs vaccination message
255, Jabs likely to wane but are boosters fair?
256, Nation locates 1 million new Pfizer doses
257, Bosses flag return to work for the jabbed
258, How sick must nation become before we are well again?
259, DELTA A SWORD ABOVE OUR HEADS
260, Politicians have abdicated responsibility for this crisis
261, Death toll could hit 2000 in months
262, Death toll could hit 2000 in months
263, Labor calls for $300 payments for vaccinated Aussies
264, Hunt supports rapid testing
265, No time to fight this fire with Pfizer: Hunt:   VACCINATION PUSH | EXCLUSIVE
266," Don't wait for Pfizer in outbreak, warns Hunt:   EXCLUSIVE"
267, Health experts warn over herd immunity goal:   EXIT ROADMAP
268, The young & the not-so-reckless
269, The young & the not-so-reckless
270, The vaccination rate needed to end lockdowns
271, The vaccination rate needed to end lockdowns
272, Midlife Victorians go for gold
273, Midlife Victorians go for gold
274, Just 40pc in Sydney are staying at home
275, Bite the bullet and lockdown hard
276, Vaccine's roadmap aimed at restoring trust
277, Politicking won't help NSW move forward:   The Age's View
278, Vaccine's roadmap aimed at restoring trust
279, Vaccine's roadmap aimed at restoring trust
280, Govt 'incompetence' to blame for aged care cases: Labor
281, Govt 'incompetence' to blame for aged care cases: Labor
282, SHUTTING DOWN IS A POOR FIX
283, This has to be last lockdown
284, Hotel boss quits
285, FALSE ALARM ON ‘BEAST’ CASES
286, PoliticsNow: No surgery for Daniel Andrews
287, HOPE FOR 20KM CIRCLE OF TRUST
288, LETTERS
289, Anger builds amid demands to ‘open up’
290, Anger builds amid demands to ‘open up’
291, MIKAKOS SAYS AIM IS ZERO
292, MIKAKOS SAYS AIM IS ZERO
293, More freedoms faster
294, ‘Elimination’ looks possible
295, HORROR COST IF BANS PERSIST
296, 'Don't undo good work'
297, Facing Facts
298, The virus puzzle
299, Victoria in a state of 'new normal'
300, Death outlook halves
301," Last Post: Higher interest rates, a new Premier and abolishing stamp duty"
302," 1638 cases, two deaths; sp ike in Covid hospital cases overnight"
303, Townsville Mayor addresses rising sea threat and call for ‘climate emergency’ declaration
304, Endless roadblocks to crucial roadmap
305, Endless roadblocks to crucial roadmap
306, Govt on defensive over border plans
307, Endless roadblocks to crucial roadmap
308, Tassie’s borders tighten as Victoria’s cases spike
309, Lockdown exit at risk after record virus tally
310, The time is right for a fresh challenge on state borders
311, National cabinet meeting to decide whether states stick to roadmap out of Covid-19 restrictions
312, Queensland on edge as CHO reveals what will trigger another lockdown
313, Covid Qld: New case spring up as authorities scramble to trace contacts
314, Bill Shorten criticises Scott Morrison for leaving Australia a divided nation
315, ‘What’s his name?’ Palaszczuk’s snipe at Barnaby Joyce as Queensland records zero new Covid-19 cases
316, Locked-down and out in Daniel Andrews’ penal pandemic paradise
317," Thousands of daily cases and many deaths loom, modelling shows"
318, Covid-19 restrictions Dan Andrews won’t ease at 80 per cent vaccinated
319, Peta Credlin is right: Dan Andrews trails Gladys Berejiklian
320," NSW Covid updates: Thirteen deaths, 1083 Covid cases and 51 per cent fully vaxxed"
321, No return to pre-pandemic living ‘in a reasonable time frame’: JPMorgan
322, State and federal politicians bickering over support as tourism industry bleeds ‘$7m a day’
323," For the premiers playing politics of fear, the game’s up"
324, Two jabs key to unlocking Victorian events
325, Premier apologises over NRL flight as state records zero Covid cases
326, ‘MISLEADING’ FROM FRONT
327, Conflict over use of Covid outlook
328," Deaths, children become leaders' focus"
329," Deaths, children become leaders' focus"
330, Queensland Premier says thousands will die each month if borders open
331, Anguish at states' tiny steps out of lockdown
332," NSW hits 70 per cent of first dose Covid-19 vaccines, signalling reopening within just weeks"
333, Hospitals face ‘cycle of crisis’ with vaccine rates below 80pc
334, COVID plan concerns
335, Living with COVID? Read the fine print
336, Our mindset needs to change to open up
337, Rebel WA splits from national cabinet amid health system fears
338, Problems not over when we get to 80pc
339, Passengers to choose fully vaccinated taxi drivers via 13 Cabs
340, DUMMY’S GUIDE TO THE CURRENT COVID-19 ARgY BARGY
341, DUMMY’S GUIDE TO THE CURRENT COVID-19 ARGY BARGY
342, DUMMY’S GUIDE TO THE CURRENT COVID-19 ARGY BARGY
343, How to stop spread of Delta: jab all teenagers
344, How to stop spread of Delta: jab all teenagers
345, Covid-19 Australia: Labor senator Katy Gallagher in ‘strict quarantine’ as daughter tests positive for Covid
346, Covid-19 Australia: Mark McGowan hits back after Scott Morrison accuses him of acting ‘against the country’s interests’
347, Businesses groups urge McGowan to ‘stick to the plan’ to reopen Australia
348, Premiers’ conflicting strategies will lead to a nation in chaos
349, Reopening in danger unless cases hit zero:   EXCLUSIVE
350, Coronavirus Australia live news: Western NSW regions plunged into snap lockdown
351," Coronavirus Australia live news: Gladys Berejiklian plans freedoms for the vaccinated as NSW records 344 new cases, two deaths"
352, CORONAVIRUS MOVING FORWARD Contact tracers to stay
353, CORONAVIRUS MOVING FORWARD Contact tracers to stay
354, Unmasking the truth about the path to freedom
355," Coronavirus Australia live news: National cabinet agrees Covid plan; worst day yet for NSW with 291 cases; 10 in Qld, six in Victoria"
356," Covid-19: ‘We could hit 80pc fully vaccinated by November’, economists say"
357, Covid has changed us culturally
358, James Morrow: Australians still unclear of way forward in Covid battle
359, Covid rules ‘must stay’
360, Needles swing to under 40s
361, Needles swing to under 40s
362, Needles swing to under 40s
363, Covid rules ‘must stay’
364, Why attention is turning to vaccinating young adults
365, South Australians stranded in NSW struggle to return; 40 per cent of SA adults have first vaccine
366, Getting the lockdown low-down:   Explainer
367, Do lockdowns work?
368, More snap lockdowns on the horizon
369, Coronavirus Australia live news: Support packages for locked-down NSW residents imminent
370, States must honour PM’s plan to reopen the nation
371," Covid-19: States hold key to freedom from lockdowns, business warns"
372, Coronavirus Australia live news: PM commits 20m doses to world vaccine effort
373," Curbs, tests could be tactic for years yet"
374, Coronavirus Australia live news: Feds secure 20m extra Pfizer vaccines: Scott Morrison
375, NSW’s Northern Beaches coronavirus cluster reaches 17 after 12 new cases detected
376, DOOR OPEN TO GO FASTER
377, Sunday Herald Sun EDITORIAL
378, Dan told to redo modelling
379, IT’S TOO TOUGH
380, IT’S TOO TOUGH
381, Dan told to redo modelling
382, Boffins’ costly blooper
383, Ex-Andrews MP urges Premier to release road map modelling
384, Boffins’ costly blooper
385, Boffins’ costly blooper
386, Slight hope in lockdowns
387, Slight hope in lockdowns
388, What might trigger a return to 'normal'? Why our coronavirus exit strategy is ... TBC
389," Coronavirus: what causes a 'second wave' of disease outbreak, and could we see this in Australia?"
390, Coming Out
391, Could we see a second wave of coronavirus?
392, Could we see a second wave of coronavirus?
393, Could we see a second wave of coronavirus?
394, NO RECOVERY PLAYBOOK
395, State on track to manage peak:   Exclusive
396, Young not immune to severe cases
397, Young not immune to severe cases
398, State’s $6m injection to fast-track diagnosis and treatment
399, State’s $6m injection to fast-track diagnosis and treatment
400, Canberra reaches 80% vaccination threshold
401," Congratulations, Canberra, on reaching a 70% fully vaccinated rate"
402," Congratulations, Canberra, on reaching a 70% fully vaccinated rate"
403, School’s back for summer
404, School’s back for summer
405, 'Deserve to know': Questions over secret hospital capacity report
406, 'Deserve to know': Questions over secret hospital capacity report
407, ISO RULES TO BE EASED
408, Premier draws a line on borders
409, Rapid-testing companies left in the dark
410, Rapid-testing companies left in the dark
411, Do not be surprised if 80pc becomes 90 ... but it should not
412, Do not be surprised if 80pc becomes 90 ... but it should not
413, LET’S DO THIS TOGETHER ... AND DO IT NOW
414, LET’S DO THIS TOGETHER ... AND DO IT NOW
415, LET’S DO THIS TOGETHER ... AND DO IT NOW
416, LET’S DO THIS TOGETHER ... AND DO IT NOW
417, AMA calls on suffering cities to take it slow:   Exclusive
418, LET’S DO THIS TOGETHER ... AND DO IT NOW
419, LET’S DO THIS TOGETHER ... AND DO IT NOW
420, LET’S DO THIS TOGETHER ... AND DO IT NOW
421, LET’S DO THIS TOGETHER ... AND DO IT NOW
422, LET’S DO THIS TOGETHER ... AND DO IT NOW
423, LET’S DO THIS TOGETHER ... AND DO IT NOW
424, Rapid testing fast-tracked for homes
425," New rules, different tools for travel"
426, Have your say
427, Here's your shot to win a $10k vaccination prize
428, Latest figures suggest lockdown increasingly unlikely to end next week
429, Latest figures suggest lockdown increasingly unlikely to end next week
430, Have your say
431, Australia's vaccine supply issues are over: Frewen
432, International travel hopes rebound with more vaccine supply
433, International travel hopes rebound with more vaccine supply
434, Premier living in state of ‘denial’
435, Lagging states widen the divide before reopening
436, Albanese goes cold on Premier’s push
437, Lagging states widen the divide before reopening
438, A system at the point of collapse
439, HOMES BECOME A NIGHTMARE
440, Families welcome green light for children's jabs
441, Families welcome green light for children's jabs
442, Families welcome green light for children's jabs
443, Families welcome green light for children's jabs
444, Families welcome green light for children's jabs
445, Different rules for NSW schools: your questions
446, We could have more chance of Christmas in NY than Perth
447, We could have more chance of Christmas in NY than Perth
448," We're rival MPs, but schoolkids' fate unites us"
449, Protecting children above party politics
450, ACT construction industry presents plan to open sooner
451, ACT construction industry presents plan to open sooner
452, Victoria lax on vax
453, Nation must not 'fear' reopening: Prime Minister
454, Nation must not 'fear' reopening: Prime Minister
455," Transcript: Scott Morrison press conference, Monday August 23"
456, Clash looms on PM's lockdown exit target
457, PM urged to ensure an end to lockdowns:   exclusive
458," After almost three years in power, Morrison's toughest moment looms:   COMMENT"
459, Booster ethics queried amid jab inequality
460, Primary school children face long wait for vaccines
461, Kiwis opt for caution as the world battles to open up
462, NSW freedom to come at 80% jab mark
463, NSW freedom to come at 80% jab mark
464, NSW stuck in limbo
465, Vaccination levels pave way back to work
466, When a quick buck is more important than your freedom
467, When a quick buck is more important than your freedom
468, TOGETHER WE GROW STRONGER
469, ‘Older Aussies should encourage grandkids to get shots’
470, Vaccine assurances as doses redirected to Sydney
471, NSW aims for six million jabs in arms by September
472, NSW aims for six million jabs in arms by September
