,0
473, QRR plan to let flights overseas resume:   VACCINATED TRAVELLERS | EXCLUSIVE
474, Vaccine passport plans splits Coalition:   EXCLUSIVE
475, Labor calls for $300 payments for vaccinated Aussies
476, Labor calls for $300 payments for vaccinated Aussies
477, Labor calls for $300 payments for vaccinated Aussies
478, Labor calls for $300 payments for vaccinated Aussies
479, ‘Freedom incentives’ to spur vaccination as Scott Morrison rejects cash
480, Businesses to bolster vaccines program:   exclusive
481, The young & the not-so-reckless
482, The vaccination rate needed to end lockdowns
483, The vaccination rate needed to end lockdowns
484, Aussies set for vaccine passports
485, Lessons of NSW v Victoria lockdowns
486, ‘We’re still on track for return to normal’
487, States must honour PM’s plan to reopen the nation
488, PATHWAY SET FOR ‘NORMAL’
489, Roadmap aimed at restoring trust
490, 'You get to change how you live': Morrison charts road out of pandemic
491, 'You get to change how you live': Morrison charts road out of pandemic
492, 'You get to change how you live': Morrison charts road out of pandemic
493, Herald Sun
494," Qld cut your crop, let our workers in"
495," Qld cut your crop, let our workers in"
496," Qld cut your crop, let our workers in"
497," Good signs, but we aren’t out of woods"
498, Plan to let virus infect us slowly
499, Push to let virus infect us slowly
500, Reopening plan on track despite surge in new cases
501, Reopening plan on track despite surge in new cases
502, Reopening on track despite surge
503, ICU beds for very ill harder to find
504, Bosses of Kirra cafe wrongly named as Covid exposure site by Queensland Health speak out
505, Hospitals face rationing of care
506, COVID raises the stakes - are we ready?
507, Editorial: COVID raises the stakes
508, Vics face big fine for hotel debacle
509, Vics face big fine for hotel debacle
510, COVID raises the stakes - are we ready?
511, The Victorian Health Department is facing nearly $100 million in fines
512, Comment - COVID raises the stakes
513, Comment - COVID raises the stakes
514, Comment - COVID raises the stakes
515, Comment - COVID raises the stakes
516, Comment - COVID raises the stakes
517, WE’RE STOP OF THE WORLD
518, WE’RE STOP OF THE WORLD
519, Surviving in epicentre of city's outbreak
520, LNP goes after Premier’s ‘misleading’ use of data
521, LNP goes after Premier’s ‘misleading’ use of data
522, Push beyond 80 per cent vax rates needed: report
523, Cautious road to Christmas
524, Peak pressure on our frontline
525, Not so SAGE advice
526, Interventions 'saved thousands'
527, Vaccines raging in hotspots
528, Vaccines raging in hotspots
529, Vaccines raging in hotspots
530, Clash on plan out of Covid
531, Herd immunity requires jabs for teenagers: experts
532, Put scaremongering behind us for good
533, Private hospitals plan for virus wave
534, Palaszczuk in ‘desperate denial’ of real medical advice: Treasurer
535, Hospitals face ‘cycle of crisis’ with vaccinated below 80pc
536," Just the vax, Anna: Will we OPEN at 80?"
537," Just the vax, Anna: Will we OPEN at 80?"
538," Just the vax, Anna: Will we OPEN at 80?"
539, Rebel state splits the nation
540, Open the lockdown door
541, Businesses have right to refuse entry to unvaccinated Aussies
542, xx covid lead xx
543," Vax on, vax off"
544, Queensland records two new Covid-19 cases as Premier announces vaccination rollout at state’s food depots
545, COVID ambition must stay close to zero
546," Covid-19 Australia: NSW records 681 new cases, one death; Victorian outbreak grows"
547, COVID CRISIS Dealing with the virus into future
548, Snap lockdowns now backed by Fed Gov
549, Year 12s opting out of Pfizer offer in protest
550, Covid-19 Australia: Scott Morrison’s jab incentive plan amid worrying prediction for NSW
551, PM sets Covid freedom goal
552," National cabinet agrees to COVID vaccine target, but without a timeframe"
553," National cabinet agrees to COVID vaccine target, but without a timeframe"
554," National cabinet agrees to COVID vaccine target, but without a timeframe"
555," National cabinet agrees to COVID vaccine target, but without a timeframe"
556, COVID-19 freedom when Australia hits 80 per cent vaccination
557, COVID-19 freedom when Australia hits 80 per cent vaccination
558, COVID-19 freedom when Australia hits 80 per cent vaccination
559, COVID-19 freedom when Australia hits 80 per cent vaccination
560, COVID-19 freedom when Australia hits 80 per cent vaccination
561, Vax our nation to freedom
562, Targeted lockdowns ‘to run into new year’
563, PM pledges vaccine plan to prevent lockdowns
564," Sorry, you can’t come back home"
565," Sorry, you can’t come back home"
566," Sorry, you can’t come back home"
567, Jab targets unlock path to freedom
568, Jab targets unlock path to freedom
569, COVID roadmap to rule all?
570, New outbreak dashes hopes
571, Nation told to brace for highest risk of outbreak:   Exclusive
572, Outbreak in Australia 'just a matter of time':   Exclusive
573, PoliticsNow: Princess Alexandra Hospital in lockdown as doctor tests positive
574," Jayden Moorea, Dan Shearin, Breeana Robinson: Gold Coast Titans cheerleader’s death leads to Southport committal hearing – latest reports"
575," Jayden Moorea, Dan Shearin, Breeana Robinson: Gold Coast Titans cheerleader’s death leads to Southport committal hearing – latest reports day six"
576," Jayden Moorea, Dan Shearin, Breeana Robinson: Gold Coast Titans cheerleader’s death leads to Southport committal hearing – latest reports day five"
577," Despite wobbles, experts applaud tracing"
578, Cases dive but Victorians urged to 'stay the course'
579," 60,000 virus cases went undetected, says study"
580, Kids are paying dearly for mistakes of adults
581, Don’t set table for Christmas
582, City’s liberation tied to caseload clearances
583, City’s liberation tied to caseload clearances
584, Christmas looks bleak
585, COVID border wars trigger tourist trap
586, COVID border wars trigger tourist trap
587, Push to list 'dangerous' postcodes
588, Call for ‘failed’ doomsday health forecast models to be abandoned
589, Elimination date months away: model
590, Morrison's redemption is nigh
591, Triumph of unity is PM's resurrection
592," Crisis may last years, not months"
593," Crisis may last years, not months"
594, Warnings Easter could undo hard work
595, Warnings Easter could undo hard work
596, Warnings Easter could undo hard work
597, Free childcare won't help parents worried by risk
598, Too slow of the mark?
599, Too slow off the mark?
600, Vaccine surge delivers freedom for five million
601, Vaccine surge delivers freedom for five million
602, 'Extraordinary' jab effort eases health threat
603, We need to talk about Christmas
604, NSW Freedom Day: Best reasons to enjoy the end of lockdown
605, Schools back for summer as kids get the jab
606, Endless roadblocks to crucial roadmap
607, Believing falsehoods
608, We’re all ready to be model citizens
609, We’re all ready to be model citizens
610, Hopes for fall in cases as jab numbers continue rise
611, Latrobe Valley plunged into 7 day snap lockdown
612, Opinion: Queensland’s own Three Stooges more of a tragicomedy
613, ‘The cheap casualty’: David Littleproud slams Annastacia Palaszczuk’s Christmas closed border plan
614, Qld vaccine ad campaign fails to address reopening plans
615, Potholes in road to re-election
616, Premier Daniel Andrews raises hope for crowds at Melbourne Cup with lockdown road map announcement
617, Pathway to reopening is clear
618, Unpredictable lockdowns could be replaced with timed national shutdowns
619, Home quarantine for returned overseas travellers ‘months away’
620, Home tests 'key to living with COVID'
621, Good leadership is guiding the way out of pandemic
622, Young people sidelined in COVID conversation
623, Young people sidelined in COVID conversation
624, NSW braces for surge in Covid-19 hospitalisations by October
625, Private plan for Covid wave
626, Private plan for Covid wave
627, COVID-free states told to be realistic
628, Live with the virus: Pressure builds on COVID-free states to face reality
629, Anthony Albanese goes cold on Annastacia Palaszczuk’s push
630, Morrison government’s fight with state premiers ramps up amid High Court threat
631, Morrison government’s fight with state premiers ramps up amid High Court threat
632, Annastacia Palaszczuk accused of refusing to agree to opening plan
633, Queensland Premier Palaszczuk hasn’t ruled out High Court stoush with PM over NSW border closure
634, Queensland Premier Palaszczuk hasn’t ruled out High Court stoush with PM over NSW border closure
635, Palaszczuk government yet to commit to opening state at 80 per cent vaccination rate
636, Kids on brink of violent meltdowns during lockdown
637," Teenagers to be offered vaccine this year, health minister says"
638," Teenagers to be offered vaccine this year, health minister says"
639, Queensland Premier Palaszczuk hasn’t ruled out High Court stoush with PM over NSW border closure
640," Covid-19: Sydney's ‘escalating' area of concern, vaccine supply frustrates Victorians"
641, PM’s bold gamble could lock in the election
642, Knowledge is poower
643, National cabinet unity fraying over vaccination targets
644, National cabinet unity fraying over vaccination targets
645, Death seems to be hardest word for Morrison
646, Sticking to a unified plan for the common good
647, Scott Morrison snaps at Albanese for undermining national vaccination plan
648, Mystery cases hit Victoria's hopes
649, Children are at risk from Delta
650, Surge no threat to jab goal
651, Surge no threat to jab goal
652, Steven Miles says deal to ease restrictions and lockdowns endorsed before NSW outbreak
653," The scientist, the virus and the future"
654," The scientist, the virus and the future"
655," Coronavirus Australia live news: 50pc national jab milestone; NSW records 681 cases, 57 in Victoria"
656, Covid-19 Australia: Victoria and Tasmania restricts travel from NZ as Peter Dutton sends troops to NSW-QLD border
657, Kiwis opt for caution as world battles to open up
658, When Sydney lockdown was recommended revealed
659, What will 70% jab coverage mean?:   Analysis
660, ‘We just won’t know when the next outbreak is going to be’: Qld Premier
661, Vaccination levels pave way back to work
662, UNMASKING THE PATH TO FREEDOM
663, Coronavirus Australia live news: NSW records 319 new cases; Victoria records 29 new cases; Queensland records 13 new cases
664, Josh Frydenberg: Why Victorians can be confident about their future
665, Price of 'living with COVID' must be understood
666, Path out: tracing and quarantine
667," NSW records two deaths amid 233 new cases, QLD outbreak worsens"
668, Senator calls for transparency over key vaccine data
669, Media Watch Dog: ‘With respect’? Not according to Trioli
670, New figures reveal the number of vaccinated Victorians
671, How many COVID deaths will we tolerate on the road to freedom?
672, Rita Panahi: ‘Gold standard’ Gladys Berejiklian’s dramatic fall from grace
673, Higher vaccination targets for over-70s before nation opens
674, Don’t shoot the messenger
675, Andrews pivot on COVID target:   Analysis
676," ONCE IT WAS DISTANCE, BUT A NEW TYRANNY IS ABROAD"
677, Let common sense be our guide
678, MODELLING ERROR HIDDEN
679, COVID CODE KEPT HIDDEN
680, MODELLING ERROR HIDDEN
681, MODELLING ERROR HIDDEN
682, COVID CODE KEPT HIDDEN
683, COVID CODE KEPT HIDDEN
684, COVID CODE KEPT HIDDEN
685, Lockdown hope: state on track for new lows
686, Lockdown works or 500 cases every day
687, Lockdown works or 500 cases every day
688, INFLATED PANDEMIC ESTIMATES WEAKEN CLIMATE FORECASTS
689, PASSING THE TEST
690, WHICH WAY OUT
691, Restrictions won't change for four weeks: PM
692, Restrictions won't change for four weeks: PM
693, Restrictions won't change for four weeks: PM
694, Restrictions won't change for four weeks: PM
695, They've got your whole world in their hands - and want to save it
696, It’s looking up Down Under
697, Easter warning to stay at home
698, It’s looking up Down Under
699, It's time to loosen the blindfolds
700, Vaccine surge delivers freedom for five million
701, Freedom pushed forward
702, COVID peak \weeks off' amid border rule disarray
703, Huge change for Victoria-NSW border as state records 2179 new cases and six deaths
704, Huge change for Victoria-NSW border as state records 2179 new cases and six deaths
705, Victorian reopening plan on track despite surge in new Covid-19 cases
706, Daily Telegraph editorial: End the eastern suburb’s cocaine culture
707, IN-HOME FOR COVID XMAS
708, IN-HOME FOR COVID XMAS
709," Daily Telegraph editorial: Vaccin ation target hit, so why hold back?"
710, Queensland Health Minister lashes Prime Minister Scott Morrison’s ‘unfair’ border roast
711, LINES OF EVASION
712, Vow to get Victoria open as Covid-19 cases rocket
713, Vaccines begin to quell ICU numbers:   HOSPITALISATIONS PLATEAU
714, 241 Victorians hospitalised with COVID-19 as Treasurer slams 'reprehensible' protestors
715, Political lens key to states' varied paths to freedom
716, Darkest days loom on path to 'normal':   Analysis
717, Editorial: Don’t be surprised if 80 per cent suddenly becomes 90 per cent
718, Even true libertarians can support vax passports
719, COVID-infected health worker confirmed to have worked in Ballarat
720, COVID facts under pressure: we need a reopening we can trust
721, Backflip on aged care Covid plan
722, COVID crunch for health system
723, COVID crunch for health system
724," It’s our daycare of reckoning as girl , 4, gets virus"
725," It’s our daycare of reckoning as girl, 4, gets virus"
726, Worsening COVID week as leaders argue over vaccination triggers to end lockdowns
727, Palaszczuk ploy is just playing with numbers
728, Queensland Premier says thousands will die each month if borders open
729, Premiers quit Covid path out
730, Premiers quit Covid path out
731, Annastacia Palaszczuk may keep Queensland border closed until kids are jabbed
732, Michaelia Cash: states border powers fall at 80 per cent vaccination
733, Leaders still at odds on threshold
734, Leaders still at odds on threshold
735, National COVID plan could see state suffer
736, Albanese gets the short end of stick from Bill
737, In her words: Why the Premier is going it alone with the Wellcamp regional quarantine hub
738, Covid will stick around: experts
739, Palaszczuk stays cagey on the plan to open up
740, Palaszczuk stays cagey on the plan to open up
741, Pfizer doses welcomed
742, 'Brakes are failing' on NSW's delta response
743, Freedoms for fully vaccinated under national proposals
744, A PLAN B FOR DELTA
745, Brakes are failing on delta outbreak
746, ‘This groundhog day has to end’: PM gets set for lockdown showdown
747, Denying support to people in lockdown would be 'electoral suicide' for Coalition: Barr
748, Denying support to people in lockdown would be 'electoral suicide' for Coalition: Barr
749, Denying support to people in lockdown would be 'electoral suicide' for Coalition: Barr
750, Denying support to people in lockdown would be 'electoral suicide' for Coalition: Barr
751, Youth in Pole position
752, Youth in Pole position
753, COVID vaccines and kids: a complex equation
754, Premier Daniel Andrews sets new vaccination target as 15 new cases emerge
755, 15 new cases as South Melbourne Market named as Tier 1 site
756, There's no defence for reckless reopening plan
757, Mapping a road to recovery
758, Mapping a road to recovery
759," Agility, volatility and reality in the age of COVID"
760," Agility, volatility and reality in the age of COVID"
761, Path from lockdown hinges on vaccination
762, Vaccinated get 'special' rules in PM's unified plan
763, Coronavirus: More than 400 unaccompanied Australian children stranded overseas
764, Patient figures to ease curbs
765, Patient figures to ease curbs
766, Scientists torn over whether city's lockdown is enough to tame Delta
767, Scott Morrison’s bold lockdown claim that jab rollout will be done by Christmas
768, Kids need the jab or we’re staying shut
769, Game changer as kids in firing line
770, Game changer as kids in firing line
771, KIDS NEED THE JAB OR WE’RE STAYING SHUT
772, The weight of the world
773, Key target: immunity among elders:   Exclusive
774, Six days straight without a local COVID case in Victoria
775, Politics of vaccine sure to change
776, Coronavi rus Australia live news: NSW Health admits ‘error’ over St Joseph’s College Pfizer jabs; NSW restrictions set to remain amid 18 new cases
777, COVID roadmap in right direction
778, Flu claim by Morrison disputed by experts
779, Covid calm: Premier rebuffs lockdown calls
780, Covid calm: Premier rebuffs lockdown calls
781, Covid calm: Premier rebuffs lockdown calls
782, Covid calm: Premier rebuffs lockdown calls
783, Don't get distracted by vaccine delay blame games
784," On track to reopen, but going too soon risks a third wave"
785, Reasons to keep 5km rule challenged
786," IF HOLLYWOOD AND SPORTS HEROES ARE GOOD TO FLY, THEN WHY CAN’T WE?"
787, Regions poised to reopen in days
788, THE MODEL BEHIND OUR ROAD TO RECOVERY
789, State contact tracing last-minute digital reset:   exclusive
790, Best guess not good enough any longer
791, GUIDING LIGHT
792, CSIRO ARMED NATION FOR INFECTIOUS INVADER
793, OZ GOING THE DISTANCE
794, OZ GOING THE DISTANCE
795, RESURGENCE A REAL POSSIBILITY
796, OZ GOING THE DISTANCE
797, RESURGENCE A REAL POSSIBILITY
798, Diabolical dilemma looms even after the curve is flattened:   THE CURVE
799, It's time to loosen the blindfolds
800, COVID roadmap incoming
801, Hope returns at last after ‘pretty dark time’ in NSW Covid-19 lockdown
802, VAX RATES ON THE RISE
803, VAX RATES ON THE RISE
804, Premier stays silent on Covid exit plan
805, Premier stays silent on Covid exit plan
806, Victoria records 1638 new Covid cases but state’s road map remains ‘on track’
807, Why reopening Tasmania will be the most costly challenge yet
808, Why reopening Tasmania will be the most costly challenge yet
809, Why reopening Tasmania will be the most costly challenge yet
810, Govt on defensive over border plans
811, COVID - is our health system ready?
812, COVID - is our health system ready?
813, 100 COVID deaths predicted if state borders open
814, 100 COVID deaths predicted if state borders open
815, 100 COVID deaths predicted if state borders open
816," Regional outbreak continues to grow; new case in Ballarat, two in Moorabool"
817, 100 COVID deaths predicted if state borders open
818, COVID - is our health system ready?
819, Feds pile pressure on Prem
820, Jeff’s Shed earmarked for makeshift Covid hospital amid case spike
821, More data needed on kids’ jabs: doctors
822, Non-Covid healthcare ‘is being compromised’
823, Pandemic a 'fire' on many fronts: expert:   exclusive
824," Virus to remain a 'fire' on multiple fronts, researchers say"
825, Rita Panahi: Daniel Andrews delivers a roadmap to misery
826, Health systems must be primed as nation opens up
827, Health systems must be primed as nation opens up
828, A lot must go right to get out of lockdown
829," Pubs, gyms poised to reopen next month:   Exclusive | First Orders"
830, Return to pre-pandemic life will be slow and cautious: JPMorgan
831, Return to pre-pandemic life will be slow and cautious: JPMorgan
832, Pressure on NSW ICUs looms
833, Pressure on NSW ICUs looms
834, Pressure on NSW ICUs looms
835, Pressure on NSW ICUs looms
836, Pressure on NSW ICUs looms
837, Pressure on NSW ICUs looms
838, Pressure on NSW ICUs looms
839, Pressure on NSW ICUs looms
840, Pressure on NSW ICUs looms
841, ICU nurses warn system in crisis ahead of surge in Covid-19 cases
842, COVID plan endorsed by state leader
843, COVID plan endorsed by state leader
844, COVID plan endorsed by state leader
845, COVID plan endorsed by state leader
846, Labor grapples with itself over when to open up
847, Victoria records 183 new Covid cases on Sunday
848, We must get off this COVID treadmill
849, Tough choices; ahead if elimination doesn't work
850, Delta blow: Upturn in cases; means hard choices
851, 80% DOES NOT MEAN ‘LET IT RIP’
852, More than 700 cases recorded as NSW hits six million vaccinations
853, More than 700 cases recorded as NSW hits six million vaccinations
854, Pm Backs Plan For Targets
855, Pm Backs Plan For Targets
856, Pm Backs Plan For Targets
857, A marathon and a sprint
858, Business leader backs vaccination message in fight against COVID
859, Curfew back as the city teeters on 'cliff edge'
860, National plan to manage COVID-19 into the future
861, Fortress Australia:   Explainer
862, Vaccine targets review for NT
863, National plan to manage COVID-19 into the future
864, No accounting for Covid-dumb fearmongering
865, No accounting for Covid-dumb fearmongering
866, No accounting for   Covid-dumb fearmongering
867," Covid-19 seeping out of eight high-risk LGAs, harsher lockdown measures needed, experts say"
868, Brisbane still clear
869, Herald Sun
870, Pandemic road map on right path
871, Lockdown-weary hope NSW gamble opens doors in future:   Analysis
872, Shannon Deery: Life in Victoria must continue as Covid spot fires emerge
873, Open Season
874, The New Normal
875, Annastacia Palaszczuk wants JobKeeper extended to aid tourism industry
876, We could be free of virus for months
877, Melbourne v Sydney: what experts say on the numbers
878, WHAT IF SOME WHEELS CAME OFF OUR FEDERAL CHARIOT?
879, NZ warning on suburb ring-fencing
880, NZ minister says proposed hotspot strategy could 'potentially allow the virus to get out of control'
881," Victoria appears past peak of second wave, experts say"
882," Victoria appears past peak of second wave, experts say"
883," Victoria appears past peak of second wave, experts say"
884," Victoria appears past peak of second wave, experts say"
885," Victoria appears past peak of second wave, experts say"
886," Victoria appears past peak of second wave, experts say"
887," Victoria appears past peak of second wave, experts say"
888," Victoria appears past peak of second wave, experts say"
889," Victoria appears past peak of second wave, experts say"
890, Virus setback should teach us key lessons
891," Second wave, ripples, or something else?:   Explainer"
892, Demand for pickers remains high – Wide Bay needs 3000
893, States race in elimination stakes
894, ‘I should’ve canned Grand Prix earlier’
895, Solving a puzzle with world looking over their shoulders
896, Solving a puzzle with world looking over their shoulders
897, Lockdown easing in sight with 'epidemic in decline'
898," Money buys hope, but not trust"
899, KEEP YOUR DISTANCE
900, Surge in cases 'will not affect reopening'
901," From slow start, Australia is now powering its way to vaccination"
902, School’s back for summer
903, School’s back for summer
904, Letters to the Editor
905, We can’t afford to live in fear
906, TEXT TALK
907, Second doses critical
908, Second doses critical
909, A reality check some needed
910, Q & A
911, Borders ‘stay shut until curbs lifted’
912, Model to change isolation approach
913, Scott Morrison throws down gauntlet to rebel premiers
914, POP-UP MEDICAL CENTRE
915, POP-UP MEDICAL CENTRE
916, POP-UP MEDICAL CENTRE
917, ‘Delta is the gift we don’t want from ScoMo’: Miles slams ‘dishonest’ reopening plan
918, Premier draws a line on borders
919, Premier draws a line on borders
920, Andrews' Victorian road map has stark choices
921, Herald Sun
922, Major changes to come next month
923, Major changes to come next month
924, Queensland might not reopen to Australia until it reaches 90 per cent vaccination rate
925, 3000 may die on the road to freedom
926, Dan’s slow road to nowhere
927, Even true libertarians can support vax passports
928, Herald Sun
929, Push for Cup fans as Dan mulls plan
930, Push for Cup crowd as Dan mulls it over
931, 'Show us the health advice on NSW reopening plan': Plibersek
932, 'Show us the health advice on NSW reopening plan': Plibersek
933, Data behind reopening plan 'too optimistic':   Exclusive
934, LETTERS TO THE EDITOR
935, On the wrong track with questionable calls
936, Australia's vaccine supply issues are over: Frewen
937, NSW backflips on aged-care patients
938, NSW backflips on aged-care patients
939, Stop fear-mongering and get with the plan
940, JOURNOS SPLIT ON PARTY LINES
941, Children in ICU as patients increase
942, Children in ICU as patients increase
943, Jabs for kids backed over UK finding:   EXCLUSIVE
944," Data warns of 40,000 cases daily"
945, Andrew Barr and the spotlight of the pandemic press conference
946, Andrew Barr and the spotlight of the pandemic press conference
947, Where we're at on jabs and kids:   Explainer
948, When a playground reopening is cause for genuine excitement
949, When a playground reopening is cause for genuine excitement
950, Pandemic sacrifices have not been in vain
951, Feds muscle up on borders
952, Feds muscle up on borders
953, Feds muscle up on borders
954, Business backs PM's call on reopening
955, Economy must be part of plans to reopen:   The Age's View
956, Economy should be factored into reopening plans:   The Herald's View
957, ‘Safe to reopen’ at 80pc
958, Child jabs get green light
959, The heavy weight of freedom
960, The heavy weight of freedom
961, Strewth!
962, Strewth!
963, Strewth!
964, Letters
965, Letters
966, TEXT TALK
967, STREWTH
968, STREWTH
969, Strewth!
970, Most workers support vaccination passports
971," NSW, the iso state"
972," NSW, the iso state"
973, Children and Delta
974, Delta 'Super Six' blitz
975, Delta 'Super Six' blitz
976, Delta 'Super Six' blitz
977, Delta 'Super Six' blitz
978, We will need an inquiry to learn from rollout mistakes
