,title,publication,date,exclude,MWPS,MStopWPS,sentence_per_article,Burnet,Doherty,BlakelyThompson,mean_sent,title_word_count,title_stop_words,title_sent,title_fear,mean_title_sent
1672, More consistency needed on borders," The Age; Melbourne, Vic."," Nov 8, 2021",0.0,23.24137931034483,9.275862068965518,29.0,,Doherty,,0.02623666619609825,5.0,1.0,1.0,0.0,0.2
1673, WA lags in facing reality of a future living with COVID," Sydney Morning Herald; Sydney, N.S.W."," Nov 8, 2021",0.0,23.11764705882353,8.941176470588236,34.0,,Doherty,,0.020958634999555716,11.0,4.0,0.0,0.0,0.0
1674, Scott Morrison won't commit to time frame but says 70pc vaccination target 'absolutely achievable':   Scott Morrison believes fully vaccinating 70 per cent of Australians is an achievable goal but he is careful not to commit to a timeframe to reach the target following significant criticism of delays in the vaccine rollout so far., ABC Premium News; Sydney," Jul 31, 2021",0.0,26.054054054054053,9.054054054054054,37.0,,Doherty,,0.018268487725779457,57.0,18.0,2.0,0.0,0.03508771929824561
1675, Coronavirus live news Australia: Delta-day for southeast Queensland as more schools alerted; NSW Police deter protesters; NRL and AFL reschedule matches," The Australian (Online); Canberra, A.C.T."," Jul 30, 2021",1.0,32.294117647058826,11.070588235294117,85.0,,,,0.020208340908584498,24.0,4.0,0.0,0.0,0.0
1676," Moment of truth, for us — and for Morrison"," The Australian (Online); Canberra, A.C.T."," Jul 30, 2021",0.0,18.766129032258064,6.709677419354839,124.0,,Doherty,,0.01676258812206878,10.0,4.0,1.0,0.0,0.1
1677, Scott Morrison sets a goal of 16.8m shots to Covid-19 freedom," The Australian (Online); Canberra, A.C.T."," Jul 30, 2021",0.0,30.324324324324323,11.08108108108108,37.0,,Doherty,,0.025572926516705518,11.0,3.0,1.0,0.0,0.09090909090909091
1678, Australia to hit next phase of Covid recovery when 70 per cent vaccinated," News.com.au; Sydney, N.S.W."," Jul 30, 2021",0.0,25.09090909090909,9.681818181818182,22.0,,Doherty,,0.054192605095363326,13.0,3.0,0.0,0.0,0.0
1679, Media Watch Dog: ‘With respect’? Not according to Trioli," The Australian (Online); Canberra, A.C.T."," Jul 30, 2021",0.0,24.87769784172662,8.258992805755396,139.0,,Doherty,,0.013141179397850554,13.0,1.0,1.0,0.0,0.07692307692307693
1680, Coronavirus: More than 400 unaccompanied Australian children stranded overseas," The Australian (Online); Canberra, A.C.T."," Jul 30, 2021",0.0,32.523809523809526,11.904761904761905,21.0,,Doherty,,0.0016257179956587822,10.0,1.0,-1.0,0.0,-0.1
1681, Lockdowns to continue until high jab rates, AAP General News Wire; Sydney," Jul 30, 2021",0.0,23.16,8.6,25.0,,Doherty,,0.05627704631110204,7.0,2.0,1.0,0.0,0.14285714285714285
1682, ‘Let it rip’ would kill thousands," The Daily Telegraph; Surry Hills, N.S.W."," Jul 30, 2021",0.0,36.666666666666664,12.833333333333334,6.0,Burnet,,,0.0037559808612440196,8.0,1.0,-1.0,1.0,-0.125
1683, Vax our nation to freedom," The Advertiser; Adelaide, S. Aust."," Jul 30, 2021",0.0,29.533333333333335,9.533333333333333,15.0,Burnet,Doherty,,0.04088582430687694,5.0,2.0,1.0,0.0,0.2
1684, The young & the not-so-reckless," The Daily Telegraph; Surry Hills, N.S.W."," Jul 30, 2021",0.0,32.375,11.3125,16.0,,,,0.06391488370620661,5.0,1.0,1.0,0.0,0.2
1685, Targeted lockdowns ‘to run into new year’," The Australian; Canberra, A.C.T."," Jul 30, 2021",0.0,36.63157894736842,13.052631578947368,19.0,,Doherty,,0.01636267886868399,9.0,2.0,0.0,0.0,0.0
1686, Jab target is 70 per cent: researchers," The Courier - Mail; Brisbane, Qld."," Jul 30, 2021",0.0,32.0,11.115384615384615,26.0,Burnet,Doherty,,0.06331022228021513,8.0,1.0,0.0,0.0,0.0
1687, ‘Let it rip’ would kill thousands," The Daily Telegraph; Surry Hills, N.S.W."," Jul 30, 2021",0.0,36.666666666666664,12.833333333333334,6.0,Burnet,,,0.0037559808612440196,8.0,1.0,-1.0,1.0,-0.125
1688, Patient figures to ease curbs," Herald Sun; Melbourne, Vic."," Jul 30, 2021",0.0,32.5,11.166666666666666,12.0,Burnet,,,0.01783625730994152,5.0,1.0,1.0,0.0,0.2
1689, The young & the not-so-reckless," The Daily Telegraph; Surry Hills, N.S.W."," Jul 30, 2021",0.0,32.375,11.3125,16.0,,,,0.06391488370620661,5.0,1.0,1.0,0.0,0.2
1690, Herald Sun," Herald Sun; Melbourne, Vic."," Jul 30, 2021",0.0,36.07692307692308,12.192307692307692,26.0,Burnet,,,0.02338188497717493,2.0,0.0,0.0,0.0,0.0
1691, IT’S TIME FOR JAB RACE TO REV UP," Herald Sun; Melbourne, Vic."," Jul 30, 2021",0.0,31.806451612903224,11.32258064516129,31.0,Burnet,Doherty,,0.0643700103450113,10.0,0.0,0.0,0.0,0.0
1692, Jab target is 70 per cent: researchers," The Courier - Mail; Brisbane, Qld."," Jul 30, 2021",0.0,32.0,11.115384615384615,26.0,Burnet,Doherty,,0.06331022228021513,8.0,1.0,0.0,0.0,0.0
1693, IT’S TIME FOR JAB RACE TO REV UP," Herald Sun; Melbourne, Vic."," Jul 30, 2021",0.0,31.806451612903224,11.32258064516129,31.0,Burnet,Doherty,,0.0643700103450113,10.0,0.0,0.0,0.0,0.0
1694, ‘Let it rip’ would kill thousands," The Daily Telegraph; Surry Hills, N.S.W."," Jul 30, 2021",0.0,36.666666666666664,12.833333333333334,6.0,Burnet,,,0.0037559808612440196,8.0,1.0,-1.0,1.0,-0.125
1695, Patient figures to ease curbs," Herald Sun; Melbourne, Vic."," Jul 30, 2021",0.0,32.5,11.166666666666666,12.0,Burnet,,,0.01783625730994152,5.0,1.0,1.0,0.0,0.2
1696, The young & the not-so-reckless," The Daily Telegraph; Surry Hills, N.S.W."," Jul 30, 2021",0.0,32.375,11.3125,16.0,,,,0.06391488370620661,5.0,1.0,1.0,0.0,0.2
1697, Jab target is 70 per cent: researchers," The Courier - Mail; Brisbane, Qld."," Jul 30, 2021",0.0,32.0,11.115384615384615,26.0,Burnet,Doherty,,0.06331022228021513,8.0,1.0,0.0,0.0,0.0
1698, Leaders to discuss vaccination modelling, AAP Bulletin Wire; Sydney," Jul 30, 2021",0.0,19.166666666666668,6.066666666666666,30.0,,Doherty,,0.0435708760548914,5.0,1.0,0.0,0.0,0.0
1699, Hopes pinned on rate of 80pc," Newcastle Herald; Newcastle, N.S.W."," Jul 30, 2021",0.0,25.6,8.5,10.0,,Doherty,,-0.041212121212121214,6.0,2.0,0.0,0.0,0.0
1700, The vaccination rate needed to end lockdowns," The Canberra Times; Canberra, A.C.T."," Jul 30, 2021",0.0,28.6,9.2,20.0,,Doherty,,0.014044168323829343,7.0,1.0,0.0,0.0,0.0
1701, The vaccination rate needed to end lockdowns," The Canberra Times; Canberra, A.C.T."," Jul 30, 2021",0.0,28.6,9.2,20.0,,Doherty,,0.014044168323829343,7.0,1.0,0.0,0.0,0.0
1702, The vaccination rate needed to end lockdowns," The Canberra Times; Canberra, A.C.T."," Jul 30, 2021",0.0,28.6,9.2,20.0,,Doherty,,0.014044168323829343,7.0,1.0,0.0,0.0,0.0
1703, The vaccination rate needed to end lockdowns," The Canberra Times; Canberra, A.C.T."," Jul 30, 2021",0.0,28.6,9.2,20.0,,Doherty,,0.014044168323829343,7.0,1.0,0.0,0.0,0.0
1704, Path out is lined with big graphs," Sydney Morning Herald; Sydney, N.S.W."," Jul 30, 2021",0.0,29.714285714285715,10.0,28.0,,Doherty,,0.07246452262513887,7.0,3.0,0.0,0.0,0.0
1705, Scientists torn over whether city's lockdown is enough to tame Delta," Sydney Morning Herald; Sydney, N.S.W."," Jul 30, 2021",0.0,22.083333333333332,7.277777777777778,36.0,Burnet,,,-0.01803546361713002,12.0,3.0,-1.0,0.0,-0.08333333333333333
1706, Vaccination target a key to path out of lockdown," The Age; Melbourne, Vic."," Jul 30, 2021",0.0,30.25,9.285714285714286,28.0,,Doherty,,0.03434513484842223,9.0,4.0,0.0,0.0,0.0
1707, Magic vaccine number that will end Australia’s lockdowns, Herald Sun (Online); Melbourne," Jul 29, 2021",0.0,32.44827586206897,11.655172413793103,29.0,Burnet,Doherty,,0.06850205358767752,10.0,3.0,1.0,0.0,0.1
1708, Coronavirus Australia live news: 70 per cent vaccination needed to limit lockdowns," The Australian (Online); Canberra, A.C.T."," Jul 29, 2021",1.0,28.214285714285715,10.035714285714286,28.0,,,,0.04429750251692984,13.0,1.0,0.0,0.0,0.0
1709," Victoria records three new local COVID-19 cases, all linked and quarantined while infectious:   The cases were detected from 43,542 test results processed on Thursday. All of the new cases are linked to the current outbreak and were quarantined during their infectious period.", ABC Premium News; Sydney," Jul 29, 2021",0.0,25.78125,7.875,32.0,Burnet,Doherty,,0.02782276097060111,46.0,15.0,-2.0,2.0,-0.043478260869565216
1710, Young drive massive push for AstraZeneca jabs," The Daily Telegraph (Online); Surrey Hills, N.S.W."," Jul 29, 2021",0.0,30.058823529411764,10.588235294117647,17.0,,,,0.06877288500577201,7.0,1.0,0.0,0.0,0.0
1711, Targeted Covid-19 lockdowns ‘to run into new year’," The Australian (Online); Canberra, A.C.T."," Jul 29, 2021",0.0,38.470588235294116,13.823529411764707,17.0,,Doherty,,0.017592249318027862,10.0,2.0,0.0,0.0,0.0
1712, Greek on Halifax chef forced into hotel quarantine despite not having coronavirus, The Advertiser (Online); Adelaide," Jul 29, 2021",1.0,21.866666666666667,8.466666666666667,15.0,,,,0.014067089767429323,12.0,4.0,-1.0,2.0,-0.08333333333333333
1713, Covid-19 Australia: Scott Morrison reveals vaccination targets to get out of lockdown, Herald Sun (Online); Melbourne," Jul 29, 2021",0.0,26.216216216216218,9.234234234234235,111.0,,Doherty,,0.020230545479499786,13.0,3.0,0.0,0.0,0.0
1714, Leaders to discuss vaccination modelling, AAP General News Wire; Sydney," Jul 29, 2021",0.0,26.22222222222222,8.555555555555555,9.0,,Doherty,,0.04586236203883262,5.0,1.0,0.0,0.0,0.0
1715, Leaders to discuss vaccination modelling, AAP General News Wire; Sydney," Jul 29, 2021",0.0,18.37037037037037,5.7407407407407405,27.0,,Doherty,,0.040283906585076176,5.0,1.0,0.0,0.0,0.0
1716," $80 million lottery could boost COVID vaccine rate as part of a plan with an 80 per cent target, report finds:   Grattan Institute modelling suggests incentives like a national lottery could help Australia improve its vaccination rate.", ABC Premium News; Sydney," Jul 29, 2021",0.0,29.173076923076923,9.653846153846153,52.0,,Doherty,,0.02497732344213758,41.0,7.0,2.0,0.0,0.04878048780487805
1717, Australia reaches record virus jab numbers, AAP General News Wire; Sydney," Jul 29, 2021",1.0,23.90909090909091,7.7272727272727275,11.0,,,,0.03760422583951995,6.0,0.0,0.0,0.0,0.0
1718, Race is on to get the jab done," The Advertiser; Adelaide, S. Aust."," Jul 29, 2021",0.0,21.741935483870968,6.806451612903226,31.0,,Doherty,,0.045791258955395577,8.0,4.0,0.0,0.0,0.0
1719, Midlife Victorians go for gold," Herald Sun; Melbourne, Vic."," Jul 29, 2021",0.0,24.384615384615383,9.307692307692308,13.0,,Doherty,,0.03191793586530429,5.0,1.0,1.0,0.0,0.2
1720, Midlife Victorians go for gold," Herald Sun; Melbourne, Vic."," Jul 29, 2021",0.0,21.7,7.8,10.0,,Doherty,,0.03414682539682539,5.0,1.0,1.0,0.0,0.2
1721, Race is on to get the jab done," The Advertiser; Adelaide, S. Aust."," Jul 29, 2021",0.0,21.741935483870968,6.806451612903226,31.0,,Doherty,,0.045791258955395577,8.0,4.0,0.0,0.0,0.0
1722, PM pledges vaccine plan to prevent lockdowns," The Age; Melbourne, Vic."," Jul 29, 2021",0.0,31.785714285714285,11.0,28.0,,Doherty,,0.02407232007374605,7.0,1.0,1.0,1.0,0.14285714285714285
1723, Scientists split over Sydney's lockdown," The Age; Melbourne, Vic."," Jul 29, 2021",0.0,22.029411764705884,7.088235294117647,34.0,Burnet,,,-0.008944182810838877,6.0,1.0,-1.0,0.0,-0.16666666666666666
1724, Vaccine push to pave way for reopening:   NATIONAL CABINET | EXCLUSIVE," Sydney Morning Herald; Sydney, N.S.W."," Jul 29, 2021",0.0,27.8,10.88,25.0,,Doherty,,0.03934961296346495,12.0,2.0,0.0,0.0,0.0
1725, South Australians stranded in NSW struggle to return; 40 per cent of SA adults have first vaccine, The Advertiser (Online); Adelaide," Jul 28, 2021",1.0,21.771428571428572,7.0,35.0,,,,-0.0025928716859511987,18.0,4.0,-1.0,1.0,-0.05555555555555555
1726, New figures reveal the number of vaccinated Victorians, Herald Sun (Online); Melbourne," Jul 28, 2021",0.0,27.545454545454547,10.545454545454545,11.0,,Doherty,,0.02648382319434951,8.0,2.0,0.0,0.0,0.0
1727, Scott Morrison’s bold lockdown claim that jab rollout will be done by Christmas," News.com.au; Sydney, N.S.W."," Jul 28, 2021",0.0,29.705882352941178,11.764705882352942,17.0,,Doherty,,0.05169736504853059,15.0,5.0,1.0,0.0,0.06666666666666667
1728, Aussies set for vaccine passports," The Mercury; Hobart Town, Tas."," Jul 27, 2021",0.0,29.045454545454547,10.863636363636363,22.0,,Doherty,,0.04129979529886529,5.0,1.0,1.0,0.0,0.2
1729," Vax certificate likely by October, PM reveals"," The Gold Coast Bulletin; Southport, Qld."," Jul 27, 2021",0.0,27.5,10.2,10.0,,Doherty,,0.04756672412554765,8.0,1.0,0.0,0.0,0.0
1730, Border rules tighten in staged path to freedom," The Age; Melbourne, Vic."," Jul 27, 2021",0.0,25.390243902439025,8.317073170731707,41.0,,,Blakely,0.014463333374739403,8.0,2.0,1.0,0.0,0.125
1731," Australia's sluggish vaccination figures aren't all because of poor supply. Here's what's going wrong:   More than 150 days into Australia's vaccination rollout, no age group is yet to reach a first dose vaccination rate of 80 per cent.", ABC Premium News; Sydney," Jul 26, 2021",0.0,29.677419354838708,9.96774193548387,31.0,,Doherty,,0.015347590112094713,47.0,12.0,-1.0,0.0,-0.02127659574468085
1732, How many COVID deaths will we tolerate on the road to freedom?," Newcastle Herald; Newcastle, N.S.W."," Jul 26, 2021",0.0,24.246376811594203,8.91304347826087,69.0,,Doherty,,0.02053889217574664,13.0,5.0,0.0,0.0,0.0
1733," Australia's COVID-19 vaccination targets muddied by Delta variant, as modellers calculate country's way out:   With Australia lagging behind world vaccination rates and more than half the country in lockdown, the when and how of the nation's return to normalcy are becoming even more vital.", ABC Premium News; Sydney," Jul 25, 2021",0.0,25.238095238095237,8.5,42.0,,Doherty,,0.011171210198303796,51.0,17.0,0.0,0.0,0.0
1734, Kids need the jab or we’re staying shut," Sunday Telegraph; Surry Hills, N.S.W."," Jul 25, 2021",0.0,25.736842105263158,11.578947368421053,38.0,,Doherty,,0.007493337443461777,10.0,4.0,0.0,0.0,0.0
1735, Game changer as kids in firing line," The Courier - Mail; Brisbane, Qld."," Jul 25, 2021",0.0,26.64864864864865,12.08108108108108,37.0,,Doherty,,0.011106809501950164,7.0,2.0,0.0,0.0,0.0
1736, Game changer as kids in firing line," The Courier - Mail; Brisbane, Qld."," Jul 25, 2021",0.0,26.64864864864865,12.08108108108108,37.0,,Doherty,,0.011106809501950164,7.0,2.0,0.0,0.0,0.0
1737, KIDS NEED THE JAB OR WE’RE STAYING SHUT," Herald Sun; Melbourne, Vic."," Jul 25, 2021",0.0,26.18421052631579,11.447368421052632,38.0,,Doherty,,0.006979927073570367,10.0,0.0,0.0,0.0,0.0
1738, Getting the lockdown low-down:   Explainer," Sunday Age; Melbourne, Vic."," Jul 25, 2021",0.0,19.05263157894737,6.43859649122807,114.0,Burnet,,Thompson,-0.003898457026443792,6.0,1.0,0.0,0.0,0.0
1739, Do lockdowns work?," Sydney Morning Herald; Sydney, N.S.W."," Jul 24, 2021",0.0,18.697674418604652,6.267441860465116,86.0,Burnet,,Thompson,-0.004534251785123739,4.0,0.0,0.0,0.0,0.0
1740, Data modelling shows Sydney lockdown could stretch until September," News.com.au; Sydney, N.S.W."," Jul 21, 2021",0.0,27.470588235294116,9.941176470588236,17.0,,,Blakely,-0.009141369486197074,9.0,1.0,0.0,0.0,0.0
1741," Sorry, you can’t come back home"," Herald Sun; Melbourne, Vic."," Jul 21, 2021",0.0,41.391304347826086,13.521739130434783,23.0,Burnet,,Blakely,0.01892931839717593,9.0,3.0,0.0,0.0,0.0
1742," Sorry, you can’t come back home"," Herald Sun; Melbourne, Vic."," Jul 21, 2021",0.0,41.391304347826086,13.521739130434783,23.0,Burnet,,Blakely,0.01892931839717593,9.0,3.0,0.0,0.0,0.0
1743," Sorry, you can’t come back home"," Herald Sun; Melbourne, Vic."," Jul 21, 2021",0.0,41.391304347826086,13.521739130434783,23.0,Burnet,,Blakely,0.01892931839717593,9.0,3.0,0.0,0.0,0.0
1744, More snap lockdowns on the horizon," The Age; Melbourne, Vic."," Jul 21, 2021",0.0,23.541666666666668,8.0,24.0,,,Thompson,0.008447017776139916,6.0,2.0,1.0,0.0,0.16666666666666666
1745, OPENING GATES TO FORTRESS NZ," Wanganui Chronicle; Wanganui, New Zealand"," Jul 20, 2021",0.0,32.0,11.660714285714286,56.0,,,Blakely,0.017771330253029027,5.0,0.0,0.0,0.0,0.0
1746, TO FORTRESS NZ OPENING GATES," The New Zealand Herald; Auckland, New Zealand"," Jul 20, 2021",0.0,34.527027027027025,12.702702702702704,74.0,,,Blakely,0.01801739731083768,5.0,0.0,0.0,0.0,0.0
1747, Sydney’s lockdown not hard enough to protect Victoria as state implements hard border with NSW, Herald Sun (Online); Melbourne," Jul 20, 2021",0.0,35.75,13.458333333333334,24.0,Burnet,,Blakely,0.018154208250557132,17.0,5.0,1.0,0.0,0.058823529411764705
1748," Coronavirus Australia live news: New lockdown for Orange; SA locks down, Victoria’s lockdown extended another week, NSW records 78 new cases"," The Australian (Online); Canberra, A.C.T."," Jul 20, 2021",0.0,35.09313725490196,12.191176470588236,204.0,,,,0.02258167630213115,27.0,3.0,0.0,0.0,0.0
1749, Half of Aussies in lockdown," Herald on Sunday; Auckland, New Zealand"," Jul 18, 2021",0.0,25.608695652173914,8.130434782608695,23.0,Burnet,,,0.005639396835049008,5.0,2.0,0.0,0.0,0.0
1750, The health advice: a sword and shield for needling doubt," Sun Herald; Sydney, N.S.W."," Jul 18, 2021",0.0,24.94047619047619,8.928571428571429,84.0,,Doherty,,0.019976480034345285,11.0,3.0,-1.0,1.0,-0.09090909090909091
1751, NSW records 97 cases amid calls for tougher restrictions," Hawkes Bay Today; Hastings, New Zealand"," Jul 17, 2021",0.0,22.214285714285715,6.5,14.0,Burnet,,,-0.005666693554892313,9.0,1.0,-1.0,0.0,-0.1111111111111111
1752," NSW records 97 cases, calls for tougher restrictions"," The Northern Advocate; Whangarei, New Zealand"," Jul 17, 2021",0.0,23.615384615384617,7.0,13.0,Burnet,,,-0.006102593059114799,9.0,1.0,-1.0,0.0,-0.1111111111111111
1753," NSW records 97 cases, calls for tougher restrictions"," Wanganui Chronicle; Wanganui, New Zealand"," Jul 17, 2021",0.0,23.615384615384617,7.0,13.0,Burnet,,,-0.006102593059114799,9.0,1.0,-1.0,0.0,-0.1111111111111111
1754," NSW records 97 cases, calls for tougher restrictions"," The Daily Post; Rotorua, New Zealand"," Jul 17, 2021",0.0,23.615384615384617,7.0,13.0,Burnet,,,-0.006102593059114799,9.0,1.0,-1.0,0.0,-0.1111111111111111
1755, ‘Incredible concern’ as Covid cases rise," The New Zealand Herald; Auckland, New Zealand"," Jul 17, 2021",0.0,27.133333333333333,9.466666666666667,30.0,Burnet,,,0.0012289234880512793,8.0,1.0,0.0,0.0,0.0
1756, ‘Incredible concern’ as Covid cases rise," The New Zealand Herald; Auckland, New Zealand"," Jul 17, 2021",0.0,27.133333333333333,9.466666666666667,30.0,Burnet,,,0.0012289234880512793,8.0,1.0,0.0,0.0,0.0
1757, Gladys and Co must be held to account for mess," Weekend Australian; Canberra, A.C.T."," Jul 17, 2021",0.0,20.448979591836736,8.224489795918368,49.0,Burnet,,,-0.008993857283173009,10.0,4.0,-1.0,0.0,-0.1
1758, MORE WEEKEND JABS," Geelong Advertiser; Geelong, Vic."," Jul 17, 2021",0.0,27.444444444444443,9.777777777777779,18.0,,Doherty,,0.08061929072159252,3.0,0.0,0.0,0.0,0.0
1759, ‘We’re still on track for return to normal’," Weekend Australian; Canberra, A.C.T."," Jul 17, 2021",0.0,37.35294117647059,14.823529411764707,17.0,,Doherty,,0.055213619264130764,12.0,4.0,0.0,0.0,0.0
1760, Just 40pc in Sydney are staying at home," Weekend Australian; Canberra, A.C.T."," Jul 17, 2021",0.0,26.333333333333332,9.666666666666666,6.0,Burnet,,,0.042234848484848486,8.0,3.0,0.0,0.0,0.0
1761, Weekend worriers," Herald Sun; Melbourne, Vic."," Jul 17, 2021",0.0,25.863636363636363,9.181818181818182,22.0,,Doherty,,0.08527574694786814,2.0,0.0,0.0,0.0,0.0
1762, Jabs to ramp up over 7 days," The Mercury; Hobart Town, Tas."," Jul 17, 2021",0.0,27.27777777777778,9.88888888888889,18.0,,Doherty,,0.08523112171926986,7.0,3.0,0.0,0.0,0.0
1763, New regulations for south-west could come into force today," Sydney Morning Herald; Sydney, N.S.W."," Jul 17, 2021",0.0,29.8125,9.5,32.0,Burnet,,,-0.0007717126497442219,9.0,2.0,-1.0,1.0,-0.1111111111111111
1764, The weight of the world," The Age; Melbourne, Vic."," Jul 17, 2021",0.0,22.24778761061947,6.876106194690266,113.0,Burnet,,Thompson,0.00732199754043116,5.0,2.0,0.0,1.0,0.0
1765, Gladys Berejiklian and co must be held to account for this mess," The Australian (Online); Canberra, A.C.T."," Jul 16, 2021",0.0,20.851063829787233,8.48936170212766,47.0,Burnet,,,-0.00937657461437186,12.0,5.0,-1.0,0.0,-0.08333333333333333
1766, ‘We’re still on track for return to normal’: Morriso n," The Australian (Online); Canberra, A.C.T."," Jul 16, 2021",0.0,39.46666666666667,15.933333333333334,15.0,,Doherty,,0.06257543516601487,15.0,4.0,0.0,0.0,0.0
1767," Coronavirus: Only 40pc of Sydney people staying at home, modelling says"," The Australian (Online); Canberra, A.C.T."," Ju l 16, 2021",0.0,30.61111111111111,11.11111111111111,18.0,Burnet,,,0.04307385565938758,13.0,2.0,0.0,0.0,0.0
1768, Jury out on case number trajectory," The Age; Melbourne, Vic."," Jul 16, 2021",0.0,20.727272727272727,6.696969696969697,33.0,,,Thompson,-0.012072056913954148,6.0,2.0,-1.0,1.0,-0.16666666666666666
1769," NSW lockdown to suppress the COVID-19 Delta strain is not working, expert says:   NSW joins a list of countries in South-East Asia that are learning the hard way that the tools used last year to successfully stop the spread of COVID-19 aren't enough to contain the Delta strain.", ABC Premium News; Sydney," Jul 14, 2021",0.0,26.692307692307693,9.038461538461538,26.0,Burnet,,,-0.012390021411760543,52.0,18.0,2.0,1.0,0.038461538461538464
1770, Coronavirus Australia live news: New venue alerts as Sydney lockdown extended," The Australian (Online); Canberra, A.C.T."," Jul 14, 2021",1.0,31.571428571428573,9.476190476190476,21.0,,,,0.00798398776872775,12.0,1.0,0.0,1.0,0.0
1771, Even Gladystan is not immune from hysterics," Herald Sun; Melbourne, Vic."," Jul 14, 2021",0.0,31.64516129032258,12.0,31.0,,Doherty,,0.03144991560790453,7.0,3.0,0.0,0.0,0.0
1772, Sydney's COVID-19 lockdown likely to be extended — but no-one knows when it will need to end:   It's the question on every Sydneysider's lips — when will the COVID-19 lockdown affecting the city and its surrounding areas end? This is why no-one knows the answer., ABC Premium News; Sydney," Jul 13, 2021",0.0,26.944444444444443,9.75,36.0,Burnet,,,0.012145387871427715,51.0,18.0,1.0,0.0,0.0196078431372549
1773, Rita Panahi: ‘Gold standard’ Gladys Berejiklian’s dramatic fall from grace, Herald Sun (Online); Melbourne," Jul 13, 2021",0.0,31.428571428571427,12.142857142857142,28.0,,Doherty,,0.027909786873030702,15.0,2.0,0.0,0.0,0.0
1774, Locked-down and out in Daniel Andrews’ penal pandemic paradise," The Australian (Online); Canberra, A.C.T."," Sep 21, 2021",0.0,24.525,9.05,40.0,Burnet,Doherty,,-0.02030657199186404,10.0,3.0,-2.0,2.0,-0.2
1775," More data needed on kids’ Covid-19 jabs, say doctors"," The Australian (Online); Canberra, A.C.T."," Sep 21, 2021",0.0,33.5,12.6,20.0,,Doherty,,0.0021936622483970714,11.0,1.0,0.0,0.0,0.0
1776," Opinion: Don’t bank on open borders for Christmas, Palaszczuk won’t allow it"," The Courier - Mail (O nline); Brisbane, Qld."," Sep 21, 2021",0.0,23.416666666666668,8.833333333333334,12.0,,Doherty,,0.031507694375341434,18.0,6.0,0.0,0.0,0.0
1777," Coronavirus: Non-Covid healthcare under stress, says AMA president Omar Khorshid"," The Australian (Online); Canberra, A.C.T."," Sep 21, 2021",0.0,43.38461538461539,18.23076923076923,13.0,,Doherty,,0.04799867920363703,12.0,1.0,0.0,0.0,0.0
1778," Queensland records zero local COVID-19 cases, applies new restrictions to NSW border bubble after lockdown announced:   Queensland will tighten border restrictions for the Tweed and Byron shires in northern New South Wales after a lockdown was announced for those regions.", ABC Premium News; Sydney," Sep 21, 2021",0.0,23.413793103448278,7.655172413793103,29.0,,Doherty,,0.0015152542776230944,43.0,12.0,0.0,0.0,0.0
1779, Rapid-testing companies left in the dark," The Canberra Times; Canberra, A.C.T."," Sep 21, 2021",1.0,33.0,12.0,10.0,,,,-0.01592655473809973,6.0,2.0,0.0,0.0,0.0
1780, Political lens key to states' varied paths to freedom," The Age; Melbourne, Vic."," Sep 21, 2021",0.0,30.32,9.96,25.0,Burnet,,,0.005179879981839393,10.0,2.0,1.0,0.0,0.1
1781, Intensive care overhaul," The Age; Melbourne, Vic."," Sep 21, 2021",0.0,27.2,7.2,5.0,Burnet,,,-0.003999999999999998,3.0,0.0,0.0,0.0,0.0
1782, Rapid-testing companies left in the dark," The Canberra Times; Canberra, A.C.T."," Sep 21, 2021",1.0,33.0,12.0,10.0,,,,-0.01592655473809973,6.0,2.0,0.0,0.0,0.0
1783, ICU needs overhaul to handle case surge," The Age; Melbourne, Vic."," Sep 21, 2021",0.0,31.74074074074074,9.88888888888889,27.0,Burnet,,,0.011020333996370323,7.0,1.0,-1.0,1.0,-0.14285714285714285
1784, Delta death risk higher than exit plan models," The Age; Melbourne, Vic."," Sep 21, 2021",0.0,32.52,11.88,25.0,Burnet,Doherty,,0.012718496216779972,8.0,1.0,-2.0,2.0,-0.25
1785," Virus to remain a 'fire' on multiple fronts, researchers say"," The Age; Melbourne, Vic."," Sep 21, 2021",0.0,30.666666666666668,10.666666666666666,21.0,,Doherty,,0.022815382633054444,12.0,3.0,0.0,0.0,0.0
1786, Doherty says restrictions shouldn't ease until 80pc vaxxed in some places," The Border Mail; Albury-Wodonga, N.S.W."," Sep 21, 2021",0.0,36.0,12.5,6.0,,Doherty,,0.04892581017454627,12.0,4.0,1.0,0.0,0.08333333333333333
1787, 'There's a chance he'll die'," The Examiner; Launceston, Tas."," Sep 21, 2021",0.0,25.86111111111111,9.222222222222221,36.0,,Doherty,,0.000514670301616354,8.0,2.0,-1.0,1.0,-0.125
1788," Qld cuts Tweed, Byron from border bubble", AAP General News Wire; Sydney," Sep 21, 2021",1.0,27.75,9.5,4.0,,,,0.01248504784688995,8.0,1.0,0.0,0.0,0.0
1789," Qld cuts Tweed, Byron from border bubble", AAP Bulletin Wire; Sydney," Sep 21, 2021",0.0,23.695652173913043,7.434782608695652,23.0,,Doherty,,0.009795329294925473,8.0,1.0,0.0,0.0,0.0
