,title,publication,date,exclude,MWPS,MStopWPS,sentence_per_article,Burnet,Doherty,BlakelyThompson,mean_sent,title_word_count,title_stop_words,title_sent,title_fear,mean_title_sent
486, Treasurer lashes Qld premier," Waikato Times; Hamilton, New Zealand"," Sep 3, 2021",0.0,21.47826086956522,7.173913043478261,23.0,,,Blakely,0.024308612663663666,4.0,0.0,1.0,0.0,0.25
487," The Doherty Report: here, for you"," The Canberra Times; Canberra, A.C.T."," Sep 3, 2021",0.0,22.0,7.714285714285714,14.0,Burnet,Doherty,,0.01968817931550851,8.0,3.0,0.0,0.0,0.0
488," Deaths, children become leaders' focus"," The Canberra Times; Canberra, A.C.T."," Sep 3, 2021",0.0,26.757575757575758,8.787878787878787,33.0,,Doherty,,0.03494562048952705,7.0,0.0,1.0,0.0,0.14285714285714285
489," Deaths, children become leaders' focus"," The Canberra Times; Canberra, A.C.T."," Sep 3, 2021",0.0,26.757575757575758,8.787878787878787,33.0,,Doherty,,0.03494562048952705,7.0,0.0,1.0,0.0,0.14285714285714285
490, Treasurer lashes Qld premier," The Nelson Mail; Nelson, New Zealand"," Sep 3, 2021",0.0,21.47826086956522,7.173913043478261,23.0,,,Blakely,0.024308612663663666,4.0,0.0,1.0,0.0,0.25
491, Treasurer lashes Qld premier," The Marlborough Express; Blenheim, New Zealand"," Sep 3, 2021",0.0,21.47826086956522,7.173913043478261,23.0,,,Blakely,0.024308612663663666,4.0,0.0,1.0,0.0,0.25
492, Treasurer lashes Qld premier," The Press; Christchurch, New Zealand"," Sep 3, 2021",0.0,21.47826086956522,7.173913043478261,23.0,,,Blakely,0.024308612663663666,4.0,0.0,1.0,0.0,0.25
493, When a playground reopening is cause for genuine excitement," The Canberra Times; Canberra, A.C.T."," Sep 3, 2021",0.0,24.434782608695652,8.304347826086957,23.0,,Doherty,,0.0485798302294466,9.0,3.0,3.0,0.0,0.3333333333333333
494, NSW COVID-19 cases back above 1200 as 7 million jabs milestone hit," The Daily Advertiser; Wagga Wagga, N.S.W."," Sep 3, 2021",0.0,28.11764705882353,9.176470588235293,34.0,,Doherty,,0.009578927093323688,12.0,2.0,-1.0,0.0,-0.08333333333333333
495," The Doherty Report: here, for you"," The Canberra Times; Canberra, A.C.T."," Sep 3, 2021",0.0,22.0,7.714285714285714,14.0,Burnet,Doherty,,0.01968817931550851,8.0,3.0,0.0,0.0,0.0
496, When a playground reopening is cause for genuine excitement," The Canberra Times; Canberra, A.C.T."," Sep 3, 2021",0.0,24.434782608695652,8.304347826086957,23.0,,Doherty,,0.0485798302294466,9.0,3.0,3.0,0.0,0.3333333333333333
497, Political squabbles mask larger reality of life with virus," Sydney Morning Herald; Sydney, N.S.W."," Sep 3, 2021",0.0,23.625,8.84375,32.0,,Doherty,,0.016909017488124022,9.0,2.0,-1.0,0.0,-0.1111111111111111
498, Palaszczuk poisons reopening plan with faulty analysis of Doherty modelling," Sydney Morning Herald; Sydney, N.S.W."," Sep 3, 2021",0.0,18.62857142857143,6.114285714285714,35.0,,Doherty,,-0.014724526174106007,10.0,2.0,-1.0,0.0,-0.1
499, Live with the virus: Pressure builds on COVID-free states to face reality," Sydney Morning Herald; Sydney, N.S.W."," Sep 3, 2021",0.0,27.61904761904762,9.761904761904763,21.0,,Doherty,,0.03364731783940958,13.0,4.0,-1.0,0.0,-0.07692307692307693
500," Vic paramedics, triple zero under pressure", AAP General News Wire; Sydney," Sep 28, 2021",1.0,30.5,11.75,4.0,,,,-0.06447368421052632,7.0,1.0,-1.0,0.0,-0.14285714285714285
501," Ambulance, triple zero delays hit Victoria", AAP General News Wire; Sydney," Sep 28, 2021",1.0,25.571428571428573,7.714285714285714,7.0,,,,-0.028998599439775907,7.0,0.0,-1.0,0.0,-0.14285714285714285
502, Aviation worker tests positive in Qld, AAP Bulletin Wire; Sydney," Sep 28, 2021",0.0,26.59090909090909,8.5,22.0,,Doherty,,0.03438333801050855,6.0,1.0,0.0,0.0,0.0
503, Hopes for fall in cases as jab numbers continue rise," The Age; Melbourne, Vic."," Sep 28, 2021",0.0,29.423076923076923,9.384615384615385,26.0,Burnet,,Blakely,0.026089476953631976,10.0,3.0,1.0,0.0,0.1
504, Covid Qld: New case spring up as authorities scramble to trace contacts," The Courier - Mail (Online); Brisbane, Qld."," Sep 27, 2021",0.0,27.464285714285715,9.625,56.0,,Doherty,,0.0026484875440531104,13.0,3.0,-1.0,1.0,-0.07692307692307693
505, Bill Shorten criticises Scott Morrison for leaving Australia a divided nation," News.com.au; Sydney, N.S.W."," Sep 27, 2021",0.0,29.45,11.05,20.0,,Doherty,,0.02568201968201968,11.0,2.0,0.0,0.0,0.0
506," NSW road map out of lockdown compared to US, Denmark, UK"," The Daily Telegraph (Online); Surrey Hills, N.S.W."," Sep 27, 2021",0.0,36.96875,13.46875,32.0,,Doherty,,0.013669059876098216,13.0,3.0,0.0,0.0,0.0
507, Delta delay ‘to set economic recovery back by six months’," The Australian (Online); Canberra, A.C.T."," Sep 27, 2021",0.0,40.06666666666667,12.8,15.0,,Doherty,,-0.031192465345685906,12.0,2.0,0.0,1.0,0.0
508, Latrobe Valley plunged into 7 day snap lockdown, Herald Sun (Online); Melbourne," Sep 27, 2021",0.0,29.76829268292683,10.036585365853659,164.0,,Doherty,,0.035295823968392495,8.0,1.0,0.0,0.0,0.0
509, Covid-19 Qld: Premier requests modelling feds say she already has," The Courier - Mail (Online); Brisbane, Qld."," Sep 27, 2021",0.0,39.78947368421053,14.578947368421053,19.0,,Doherty,,0.04034070824073089,11.0,2.0,0.0,0.0,0.0
510, Opinion: Queensland’s own Three Stooges more of a tragicomedy," The Courier - Mail (Online); Brisbane, Qld."," Sep 27, 2021",0.0,28.431818181818183,10.863636363636363,44.0,,Doherty,,0.00025156916693003744,12.0,5.0,0.0,0.0,0.0
511, Vaccination uptake proves modelling pessimists wrong," The Australian (Online); Canberra, A.C.T."," Sep 27, 2021",0.0,31.5,11.307692307692308,26.0,Burnet,,,-0.006210183514432973,6.0,0.0,-1.0,0.0,-0.16666666666666666
512, ‘What’s his name?’ Palaszczuk’s snipe at Barnaby Joyce as Queensland records zero new Covid-19 cases," News.com.au; Sydney, N.S.W."," Sep 27, 2021",0.0,27.0,9.45,20.0,,Doherty,,0.008750744869165921,22.0,5.0,0.0,0.0,0.0
513," Queensland Opposition says authorities must lift their game to boost Indigenous vaccination:   Opposition Leader David Crisafulli visits the Indigenous community of Yarrabah in Far North Queensland, where only about 15 per cent of people are fully vaccinated. The Yarrabah Mayor says they are struggling to address entrenched vaccine hesistancy.", ABC Premium News; Sydney," Sep 27, 2021",0.0,26.52777777777778,9.083333333333334,36.0,,Doherty,,0.04328888259108327,53.0,13.0,3.0,0.0,0.05660377358490566
514, Aviation worker tests positive in Qld, AAP General News Wire; Sydney," Sep 27, 2021",0.0,26.59090909090909,8.5,22.0,,Doherty,,0.03438333801050855,6.0,1.0,0.0,0.0,0.0
515," Man tests positive in Qld, sparking alert", AAP General News Wire; Sydney," Sep 27, 2021",1.0,25.333333333333332,8.0,3.0,,,,0.044642857142857144,8.0,1.0,0.0,0.0,0.0
516, ISO RULES TO BE EASED," Herald Sun; Melbourne, Vic."," Sep 27, 2021",0.0,33.61538461538461,9.692307692307692,13.0,,Doherty,,-0.0014861366911527794,5.0,0.0,0.0,0.0,0.0
517, State plots a scenario for unvaccinated to re-enter the economy," The Australian; Canberra, A.C.T."," Sep 27, 2021",0.0,31.157894736842106,11.105263157894736,19.0,Burnet,,,0.009186945859271834,10.0,4.0,0.0,0.0,0.0
518, VICS IN ISO WIN," The Daily Telegraph; Surry Hills, N.S.W."," Sep 27, 2021",0.0,31.0,9.666666666666666,3.0,,Doherty,,0.017230576441102756,4.0,0.0,0.0,0.0,0.0
519, Reward for a jab done … one day," The Courier - Mail; Brisbane, Qld."," Sep 27, 2021",0.0,29.666666666666668,11.444444444444445,18.0,,Doherty,,0.09998088331421665,8.0,2.0,0.0,0.0,0.0
520, Model to change isolation approach," The Courier - Mail; Brisbane, Qld."," Sep 27, 2021",0.0,33.4,10.7,10.0,,Doherty,,0.004593350383631713,5.0,1.0,-1.0,1.0,-0.2
521, Qld told to prepare to reopen before Xmas, AAP Bulletin Wire; Sydney," Sep 27, 2021",0.0,24.68,8.08,25.0,,Doherty,,0.04040206679397687,8.0,3.0,1.0,0.0,0.125
522, Qld told to prepare to reopen before Xmas, AAP General News Wire; Sydney," Sep 27, 2021",1.0,27.727272727272727,8.727272727272727,11.0,,,,0.07438325348542067,8.0,3.0,1.0,0.0,0.125
523, Questions raised over regional roadmap COVID modelling," The Courier; Ballarat, Vic."," Sep 27, 2021",0.0,27.916666666666668,9.333333333333334,12.0,Burnet,,,0.04339099737617585,7.0,1.0,0.0,0.0,0.0
524, ‘The cheap casualty’: David Littleproud slams Annastacia Palaszczuk’s Christmas closed border plan," News.com.au; Sydney, N.S.W."," Sep 26, 2021",0.0,30.72222222222222,11.38888888888889,18.0,,Doherty,,0.011162185671989596,17.0,1.0,-2.0,1.0,-0.11764705882352941
525, How exposure site quarantine rules could be relaxed, Herald Sun (Online); Melbourne," Sep 26, 2021",0.0,33.083333333333336,9.75,12.0,,Doherty,,0.005965776160342065,8.0,1.0,0.0,1.0,0.0
526, Gold Coast Covid border reopening: Dramatic changes needed for tourism industry to survive, The Gold Coast Bulletin (Online); Southport," Sep 26, 2021",0.0,36.58620689655172,11.827586206896552,29.0,,Doherty,,0.03641288759248165,14.0,2.0,1.0,0.0,0.07142857142857142
527, Qld vaccine ad campaign fails to address reopening plans," The Courier - Mail (Online); Brisbane, Qld."," Sep 26, 2021",0.0,29.125,11.041666666666666,24.0,,Doherty,,0.08227105122485558,9.0,1.0,1.0,0.0,0.1111111111111111
528, Covid-19: NSW plots a scenario for unvaccinated to re-enter the economy," The Australian (Online); Ca nberra, A.C.T."," Sep 26, 2021",0.0,34.266666666666666,12.133333333333333,15.0,Burnet,,,0.0107643050420049,12.0,4.0,0.0,0.0,0.0
529, Scott Morrison throws down gauntlet to rebel premiers," News.com .au; Sydney, N.S.W."," Sep 26, 2021",0.0,26.84090909090909,10.659090909090908,44.0,,Doherty,,0.018430474891584378,8.0,2.0,-1.0,1.0,-0.125
530, POP-UP MEDICAL CENTRE," Herald Sun; Melbourne, Vic."," Sep 26, 2021",0.0,26.3,9.166666666666666,30.0,Burnet,,,0.01753278148866384,3.0,0.0,0.0,0.0,0.0
531, POP-UP MEDICAL CENTRE," Herald Sun; Melbourne, Vic."," Sep 26, 2021",0.0,26.3,9.166666666666666,30.0,Burnet,,,0.01753278148866384,3.0,0.0,0.0,0.0,0.0
532, POP-UP MEDICAL CENTRE," Herald Sun; Melbourne, Vic."," Sep 26, 2021",0.0,26.3,9.166666666666666,30.0,Burnet,,,0.01753278148866384,3.0,0.0,0.0,0.0,0.0
533, Surviving in epicentre of city's outbreak," Sunday Age; Melbourne, Vic."," Sep 26, 2021",0.0,23.026785714285715,7.991071428571429,112.0,,,Thompson,-0.009629312499527046,7.0,2.0,0.0,0.0,0.0
534, LNP goes after Premier’s ‘misleading’ use of data," The Courier - Mail; Brisbane, Qld."," Sep 25, 2021",0.0,27.857142857142858,8.428571428571429,7.0,,Doherty,,-0.015158371040723982,12.0,3.0,-1.0,0.0,-0.08333333333333333
535, Jeff’s Shed earmarked for makeshift Covid hospital amid case spike, Herald Sun (Online); Melbourne," Sep 25, 2021",0.0,27.515151515151516,10.181818181818182,33.0,Burnet,,,0.019120119598811602,12.0,2.0,-2.0,3.0,-0.16666666666666666
536," South Australian businesses urged to 'pivot' regardless of COVID-19 vaccination levels:   SA's public health chief has told the state's transition committee local businesses will need to ""pivot their business models"" rather than expect a ""a return to pre-COVID conditions"" even once the state reaches high levels of vaccine uptake.", ABC Premium News; Sydney," Sep 25, 2021",0.0,29.470588235294116,9.0,17.0,,Doherty,,0.05972355845572294,58.0,14.0,4.0,0.0,0.06896551724137931
537," Be patient, minister tells stranded Qlders", AAP Bulletin Wire; Sydney," Sep 25, 2021",0.0,32.666666666666664,12.444444444444445,18.0,,Doherty,,-0.018387137506074562,7.0,0.0,0.0,0.0,0.0
538," Be patient, minister tells stranded Qlders", AAP General News Wire; Sydney," Sep 25, 2021",0.0,32.666666666666664,12.444444444444445,18.0,,Doherty,,-0.018387137506074562,7.0,0.0,0.0,0.0,0.0
539, LNP goes after Premier’s ‘misleading’ use of data," The Courier - Mail; Brisbane, Qld."," Sep 25, 2021",0.0,27.857142857142858,8.428571428571429,7.0,,Doherty,,-0.015158371040723982,12.0,3.0,-1.0,0.0,-0.08333333333333333
540, We need to work together to recover our freedoms," Weekend Australian; Canberra, A.C.T."," Sep 25, 2021",0.0,25.02777777777778,9.833333333333334,36.0,,Doherty,,0.054251694410874685,9.0,3.0,0.0,0.0,0.0
541, Missing modelling: Victoria's regional roadmap lacking evidence," The Standard; Warrnambool, Vic."," Sep 25, 2021",0.0,32.0,10.6,5.0,Burnet,,,0.07524088814411395,9.0,0.0,-1.0,0.0,-0.1111111111111111
542, Missing modelling: Victoria's regional roadmap lacking evidence," The Standard; Warrnambool, Vic."," Sep 25, 2021",0.0,32.0,10.6,5.0,Burnet,,,0.07524088814411395,9.0,0.0,-1.0,0.0,-0.1111111111111111
543, Missing modelling: Victoria's regional roadmap lacking evidence," The Standard; Warrnambool, Vic."," Sep 25, 2021",0.0,32.0,10.6,5.0,Burnet,,,0.07524088814411395,9.0,0.0,-1.0,0.0,-0.1111111111111111
544, System under stress," Central Western Daily; Orange, N.S.W."," Sep 25, 2021",0.0,25.714285714285715,9.261904761904763,42.0,,Doherty,,0.006817652888221155,3.0,1.0,-1.0,0.0,-0.3333333333333333
545, System under stress," Daily Liberal and Macquarie Advocate; Dubbo, N.S.W."," Sep 25, 2021",0.0,25.714285714285715,9.261904761904763,42.0,,Doherty,,0.006817652888221155,3.0,1.0,-1.0,0.0,-0.3333333333333333
546, System under stress," Western Advocate; Bathurst, N.S.W."," Sep 25, 2021",0.0,25.714285714285715,9.261904761904763,42.0,,Doherty,,0.006817652888221155,3.0,1.0,-1.0,0.0,-0.3333333333333333
547, System under stress," The Northern Daily Leader; Tamworth, N.S.W."," Sep 25, 2021",0.0,25.714285714285715,9.261904761904763,42.0,,Doherty,,0.006817652888221155,3.0,1.0,-1.0,0.0,-0.3333333333333333
548, Vaccinated youth key to Covid-19 freedom," Waikato Times; Hamilton, New Zealand"," Sep 25, 2021",0.0,23.84090909090909,7.636363636363637,44.0,,,Thompson,0.08484967487314327,6.0,1.0,2.0,1.0,0.3333333333333333
549, LNP want Premier probed by ethics committee over Doherty Institute modelling ‘misuse’," The Courier - Mail (Online); Brisbane, Qld."," Sep 24, 2021",0.0,28.333333333333332,9.4,15.0,,Doherty,,-0.024109996283909325,14.0,2.0,0.0,0.0,0.0
550, ‘Delta is the gift we don’t want from ScoMo’: Miles slams ‘dishonest’ reopening plan," The Courier - Mail (Online); Brisbane, Qld."," Sep 24, 2021",0.0,63.0,25.428571428571427,7.0,,Doherty,,0.044064740440006966,21.0,6.0,1.0,0.0,0.047619047619047616
551, Premier Annastacia Palaszczuk referred to Queensland Speaker over comments on Doherty Institute modelling:   Queensland Premier Annastacia Palaszczuk is referred to the Speaker by the opposition who allege she deliberately misled Parliament over Doherty Institute modelling predicting COVID-19 deaths., ABC Premium News; Sydney," Sep 24, 2021",0.0,28.037037037037038,9.851851851851851,27.0,,Doherty,,-0.012352439903609494,40.0,11.0,-2.0,0.0,-0.05
552," No new COVID-19 cases recorded in Queensland, mask requirements in public venues to ease as Miles says border debate 'bizarre':   Deputy Premier Steven Miles says the Delta strain of COVID-19 is the Christmas gift Queenslanders do not want from Prime Minister Scott Morrison. His comments come as the state reports another day of no new cases for Queensland and a slight easing of mask restrictions.", ABC Premium News; Sydney," Sep 24, 2021",0.0,31.357142857142858,10.892857142857142,28.0,,Doherty,,0.019713496315725918,70.0,19.0,4.0,0.0,0.05714285714285714
553, Premier draws a line on borders," The Australian; Canberra, A.C.T."," Sep 24, 2021",0.0,28.05128205128205,9.743589743589743,39.0,,Doherty,,0.02394747824468704,6.0,2.0,0.0,0.0,0.0
554, Premier draws a line on borders," The Australian; Canberra, A.C.T."," Sep 24, 2021",0.0,28.05128205128205,9.743589743589743,39.0,,Doherty,,0.02394747824468704,6.0,2.0,0.0,0.0,0.0
555, Premier draws a line on borders," The Australian; Canberra, A.C.T."," Sep 24, 2021",0.0,28.05128205128205,9.743589743589743,39.0,,Doherty,,0.02394747824468704,6.0,2.0,0.0,0.0,0.0
556, Protest against Qld reopening too soon, AAP Bulletin Wire; Sydney," Sep 24, 2021",0.0,29.357142857142858,10.071428571428571,14.0,,Doherty,,0.00092711173538241,6.0,2.0,0.0,0.0,0.0
557, Qlders told to wait for clarity on borders, AAP General News Wire; Sydney," Sep 24, 2021",1.0,29.77777777777778,13.222222222222221,9.0,,,,0.01447837589141937,8.0,3.0,-1.0,0.0,-0.125
558, Protest against Qld reopening too soon, AAP General News Wire; Sydney," Sep 24, 2021",0.0,29.357142857142858,10.071428571428571,14.0,,Doherty,,0.00092711173538241,6.0,2.0,0.0,0.0,0.0
559, NSW records 1043 new local COVID-19 cases, AAP General News Wire; Sydney," Sep 24, 2021",0.0,29.25,10.0,16.0,Burnet,Doherty,,-0.005709541454210238,7.0,0.0,0.0,0.0,0.0
560, Peak on NSW hospitals could be worse, AAP Bulletin Wire; Sydney," Sep 24, 2021",0.0,26.2,7.866666666666666,15.0,Burnet,Doherty,,-0.011657949220878283,7.0,2.0,-1.0,1.0,-0.14285714285714285
561, System under stress," The Daily Advertiser; Wagga Wagga, N.S.W."," Sep 24, 2021",0.0,25.714285714285715,9.261904761904763,42.0,,Doherty,,0.004436700507268775,3.0,1.0,-1.0,0.0,-0.3333333333333333
562, Is reopening model right on hospitals?," The Age; Melbourne, Vic."," Sep 24, 2021",0.0,26.869565217391305,8.565217391304348,23.0,Burnet,Doherty,Blakely,0.03074560717968853,7.0,1.0,1.0,0.0,0.14285714285714285
563, Doherty expert agrees Delta strain could push NSW hospitalisations higher than initially thought," News.com.au; Sydney, N.S.W."," Sep 23, 2021",0.0,34.27272727272727,12.363636363636363,11.0,Burnet,Doherty,,0.03612510155756899,13.0,1.0,1.0,0.0,0.07692307692307693
564, Mask restriction eased as Qld records zero new local Covid cases," News.com.au; Sydney, N.S.W."," Sep 23, 2021",0.0,27.15,10.2,20.0,,Doherty,,0.0075623683280884105,11.0,1.0,-1.0,1.0,-0.09090909090909091
565," COVID updates: Victorian police confirmed close contacts after case attended Melbourne protests — as it happened:   Officers have been identified as close contacts of a COVID-positive case who was at the protests in Melbourne this week, Victoria Police say.", ABC Premium News; Sydney," Sep 23, 2021",0.0,106.0,35.0,3.0,,Doherty,,-0.008658008658008656,43.0,14.0,0.0,3.0,0.0
566, Coronavirus: Premier Annastacia Palaszczuk casts doubt on opening Queensland borders," The Australian (Online); Canberra, A.C.T."," Sep 23, 2021",0.0,26.8,9.2,40.0,,Doherty,,0.022516217384644967,11.0,1.0,-1.0,1.0,-0.09090909090909091
567, Qld Premier Annastacia Palaszczuk fires up at reporters questioning tough border stance," News.com.au; Sydney, N.S.W."," Sep 23, 2021",0.0,32.18518518518518,11.518518518518519,27.0,,Doherty,,-0.005979156612467409,12.0,2.0,-1.0,0.0,-0.08333333333333333
568, Peak on NSW hospitals could be worse, AAP General News Wire; Sydney," Sep 23, 2021",0.0,29.8,9.3,10.0,Burnet,Doherty,,-0.006472431077694236,7.0,2.0,-1.0,1.0,-0.14285714285714285
569, Hospitalisations may be worse than thought, AAP Bulletin Wire; Sydney," Sep 23, 2021",0.0,25.75,8.321428571428571,28.0,,Doherty,,0.008981100056675021,6.0,2.0,-1.0,1.0,-0.16666666666666666
570, Hospitalisations may be worse than thought, AAP General News Wire; Sydney," Sep 23, 2021",0.0,27.2,8.666666666666666,15.0,,Doherty,,0.006189592618901179,6.0,2.0,-1.0,1.0,-0.16666666666666666
571, System under stress," Illawarra Mercury; Wollongong, N.S.W."," Sep 23, 2021",0.0,25.714285714285715,9.261904761904763,42.0,,Doherty,,0.004436700507268775,3.0,1.0,-1.0,0.0,-0.3333333333333333
572, What Aussies would have to do to avoid lockdowns," The Northern Advocate; Whangarei, New Zealand"," Sep 22, 2021",0.0,35.21052631578947,11.368421052631579,19.0,,Doherty,Blakely,0.03836058457367828,9.0,4.0,-1.0,1.0,-0.1111111111111111
573, What Aussies would have to do to avoid lockdowns," Hawkes Bay Today; Hastings, New Zealand"," Sep 22, 2021",0.0,34.31578947368421,11.210526315789474,19.0,,Doherty,Blakely,0.03864662576360964,9.0,4.0,-1.0,1.0,-0.1111111111111111
574, What Aussies would have to do to avoid lockdowns," The Daily Post; Rotorua, New Zealand"," Sep 22, 2021",0.0,35.21052631578947,11.368421052631579,19.0,,Doherty,Blakely,0.03836058457367828,9.0,4.0,-1.0,1.0,-0.1111111111111111
575, What Aussies would have to do to avoid lockdowns," Bay of Plenty Times; Tauranga, New Zealand"," Sep 22, 2021",0.0,35.21052631578947,11.368421052631579,19.0,,Doherty,Blakely,0.03836058457367828,9.0,4.0,-1.0,1.0,-0.1111111111111111
576, What Aussies would have to do to avoid lockdowns," Wanganui Chronicle; Wanganui, New Zealand"," Sep 22, 2021",0.0,35.21052631578947,11.368421052631579,19.0,,Doherty,Blakely,0.03836058457367828,9.0,4.0,-1.0,1.0,-0.1111111111111111
577, What Aussies would have to do to avoid lockdowns," The New Zealand Herald; Auckland, New Zealand"," Sep 22, 2021",0.0,35.0,11.31578947368421,19.0,,Doherty,Blakely,0.03894537989531571,9.0,4.0,-1.0,1.0,-0.1111111111111111
578," Victoria records 766 new local cases of COVID-19 and four deaths, protester in hospital with coronavirus:   A man who attended yesterdays protests has tested positive to COVID, the ABC understands, as Victoria records its highest single-day tally of the outbreak so far.", ABC Premium News; Sydney," Sep 22, 2021",0.0,24.442307692307693,8.576923076923077,52.0,Burnet,,,0.019266370156177874,47.0,13.0,0.0,2.0,0.0
579, Thousands of retired healthcare workers to return to the frontline as Covid ICU surge approaches," News.com.au; Sydney, N.S.W."," Sep 22, 2021",0.0,30.88888888888889,10.722222222222221,18.0,Burnet,,,0.04802498085297475,15.0,5.0,0.0,0.0,0.0
580, Media Release: Minister for Defence Industry - Op-Ed - AIDN Quarterly Newsletter (September), MediaNet Press Release Wire; Sydney," Sep 22, 2021",1.0,6.0,1.0,1.0,,,,0.0,16.0,1.0,0.0,0.0,0.0
581, More data needed on kids’ jabs: doctors," The Australian; Canberra, A.C.T."," Sep 22, 2021",0.0,32.85,12.4,20.0,,Doherty,,0.004498582156863888,9.0,1.0,0.0,0.0,0.0
582, Uncivil war a disaster of Premier’s making," Herald Sun; Melbourne, Vic."," Sep 22, 2021",0.0,29.419354838709676,10.516129032258064,31.0,Burnet,,,-0.0240968462477783,9.0,3.0,-2.0,2.0,-0.2222222222222222
583, Non-Covid healthcare ‘is being compromised’," The Australian; Canberra, A.C.T."," Sep 22, 2021",0.0,34.90909090909091,13.545454545454545,11.0,,Doherty,,0.042222526180397575,7.0,2.0,0.0,0.0,0.0
584, System under stress," Southern Highland News; Bowral, N.S.W."," Sep 22, 2021",0.0,25.714285714285715,9.261904761904763,42.0,,Doherty,,0.006817652888221155,3.0,1.0,-1.0,0.0,-0.3333333333333333
585, System under stress," South Coast Register; Nowra, N.S.W."," Sep 22, 2021",0.0,25.714285714285715,9.261904761904763,42.0,,Doherty,,0.006817652888221155,3.0,1.0,-1.0,0.0,-0.3333333333333333
586, System under stress," Goulburn Post; Goulburn, N.S.W."," Sep 22, 2021",0.0,25.714285714285715,9.261904761904763,42.0,,Doherty,,0.006817652888221155,3.0,1.0,-1.0,0.0,-0.3333333333333333
587, Pandemic pressure: Can NSW rural and regional health cope?," Port Macquarie News; Port Macquarie, N.S.W."," Sep 22, 2021",0.0,26.214285714285715,9.404761904761905,42.0,,Doherty,,0.006236579543526232,11.0,1.0,-1.0,0.0,-0.09090909090909091
588, Pandemic pressure: Can NSW rural and regional health cope?," Port Macquarie News; Port Macquarie, N.S.W."," Sep 22, 2021",0.0,26.023255813953487,9.255813953488373,43.0,,Doherty,,0.005864392999247363,11.0,1.0,-1.0,0.0,-0.09090909090909091
589, Ballarat hits 50% fully-vaccinated benchmark," The Courier; Ballarat, Vic."," Sep 22, 2021",0.0,33.75,10.928571428571429,28.0,,Doherty,Blakely,0.04527608658637182,6.0,0.0,0.0,0.0,0.0
590, Push beyond 80 per cent vax rates needed: report," The Bendigo Advertiser; Bendigo, Vic."," Sep 22, 2021",0.0,27.75,7.95,20.0,,Doherty,Blakely,0.03536027507894516,10.0,0.0,0.0,0.0,0.0
591, 241 Victorians hospitalised with COVID-19 as Treasurer slams 'reprehensible' protestors," The Standard; Warrnambool, Vic."," Sep 22, 2021",1.0,27.2,8.8,5.0,,,,0.018333333333333333,11.0,2.0,0.0,0.0,0.0
592, bordermail.com.au comments," The Border Mail; Albury-Wodonga, N.S.W."," Sep 22, 2021",0.0,22.36,8.28,25.0,,Doherty,,0.05227828604144394,2.0,0.0,0.0,0.0,0.0
593, A rocky path towards reopening," The Age; Melbourne, Vic."," Sep 22, 2021",0.0,20.980392156862745,6.490196078431373,51.0,,Doherty,,0.015804448413418302,5.0,0.0,0.0,0.0,0.0
594," Bleak toll warning for NSW, Victoria’s freedom meets roadblocks"," The New Zealand Herald; Auckland, New Zealand"," Sep 21, 2021",0.0,28.105263157894736,9.473684210526315,19.0,,Doherty,,0.00995191856646965,12.0,2.0,1.0,1.0,0.08333333333333333
595, Pandemic a 'fire' on many fronts: expert:   exclusive," Sydney Morning Herald; Sydney, N.S.W."," Sep 21, 2021",0.0,30.6,10.7,20.0,,Doherty,,0.025067848519461422,11.0,2.0,1.0,0.0,0.09090909090909091
596, Staffing tight as hospitals brace for hit," Sydney Morning Herald; Sydney, N.S.W."," Sep 21, 2021",0.0,31.157894736842106,9.421052631578947,19.0,Burnet,,,0.030375460876388028,7.0,2.0,-1.0,0.0,-0.14285714285714285
597," Drip-feeding our rights is so very, very wrong"," Herald Sun; Melbourne, Vic."," Sep 21, 2021",0.0,25.45945945945946,9.324324324324325,37.0,Burnet,,,-0.005004744555828148,9.0,5.0,-1.0,0.0,-0.1111111111111111
598, Herald Sun," Herald Sun; Melbourne, Vic."," Sep 21, 2021",0.0,31.555555555555557,10.88888888888889,27.0,Burnet,,,0.04010112490146316,2.0,0.0,0.0,0.0,0.0
599, OPEN UP AT 80 OR FACE AN ‘ABYSS’," The Gold Coast Bulletin; Southport, Qld."," Sep 21, 2021",0.0,33.46153846153846,10.76923076923077,13.0,,Doherty,,0.020745920745920743,10.0,0.0,0.0,0.0,0.0
600," Victoria records 71 local COVID-19 cases, Melbourne told to consider 'soft lockdown':   Premier Daniel Andrews says people should book in to get the jab as soon as possible as the state grapples to pull its worsening Delta outbreak under control. Out of 71 new local cases, only 16 were quarantined while infectious.", ABC Premium News; Sydney," Aug 22, 2021",1.0,23.263157894736842,8.31578947368421,19.0,,,,0.000777270657133359,58.0,16.0,-1.0,1.0,-0.017241379310344827
