,title,publication,date,exclude,MWPS,MStopWPS,sentence_per_article,Burnet,Doherty,BlakelyThompson,mean_sent,title_word_count,title_stop_words,title_sent,title_fear,mean_title_sent
1078, Get ready for when we let Delta into the state," The Advertiser; Adelaide, S. Aust."," Oct 2, 2021",0.0,22.89189189189189,7.486486486486487,37.0,,Doherty,,0.04605652965090119,10.0,5.0,0.0,0.0,0.0
1079, Model behaviour," Manawatu Standard; Palmerston North, New Zealand"," Oct 2, 2021",0.0,21.25,7.3023255813953485,172.0,,,Blakely,0.015465354809749622,2.0,0.0,0.0,0.0,0.0
1080, Model behaviour," The Press; Christchurch, New Zealand"," Oct 2, 2021",0.0,21.15028901734104,7.2601156069364166,173.0,,,Blakely,0.015375959695242398,2.0,0.0,0.0,0.0,0.0
1081, Model behaviour," Dominion Post; Wellington, New Zealand"," Oct 2, 2021",0.0,21.15028901734104,7.2601156069364166,173.0,,,Blakely,0.015375959695242398,2.0,0.0,0.0,0.0,0.0
1082, South-west students return to classroom," The Standard; Warrnambool, Vic."," Oct 1, 2021",0.0,20.869565217391305,6.869565217391305,23.0,Burnet,,,0.00952764817181293,5.0,1.0,0.0,0.0,0.0
1083, COVID raises the stakes - are we ready?," Mudgee Guardian and Gulgong Advertiser; Mudgee, N.S.W."," Oct 1, 2021",0.0,19.5,7.1923076923076925,26.0,,Doherty,,0.014196380542534389,9.0,3.0,0.0,0.0,0.0
1084, South-west Victorian students to return to classroom from next week," The Standard; Warrnambool, Vic."," Oct 1, 2021",0.0,24.069767441860463,8.30232558139535,43.0,Burnet,,,0.016757771413434167,10.0,3.0,0.0,0.0,0.0
1085, Editorial: COVID raises the stakes," The Young Witness; Young, N.S.W."," Oct 1, 2021",0.0,19.97142857142857,7.428571428571429,35.0,,Doherty,,0.0033176843860073676,6.0,1.0,0.0,0.0,0.0
1086, Barr calls out 'vicious' debate over reopening," The Canberra Times; Canberra, A.C.T."," Oct 1, 2021",0.0,22.058823529411764,6.352941176470588,17.0,,Doherty,,0.04843701256368625,8.0,2.0,0.0,0.0,0.0
1087, Barr calls out 'vicious' debate over reopening," The Canberra Times; Canberra, A.C.T."," Oct 1, 2021",0.0,22.058823529411764,6.352941176470588,17.0,,Doherty,,0.04843701256368625,8.0,2.0,0.0,0.0,0.0
1088," Gold Coast surf clubs, parks, cafes named as new exposure sites after case visits Kirra, Tweed Heads", The Gold Coast Bulletin (Online); Southport," Oct 1, 2021",1.0,49.0,5.5,2.0,,,,-0.03571428571428571,20.0,2.0,-1.0,1.0,-0.05
1089, Covid Qld: Latest case numbers as government insiders say next 24 hours to determine lockdown situation," The Courier - Mail (Online); Brisbane, Qld."," Oct 1, 2021",0.0,26.180555555555557,9.26388888888889,72.0,,Doherty,,0.015981934356654817,17.0,2.0,-1.0,2.0,-0.058823529411764705
1090, Tassie’s borders tighten as Victoria’s cases spike, The Mercury (Online); Hobart Town," Oct 1, 2021",0.0,29.285714285714285,10.857142857142858,14.0,,,,0.013644974204461155,11.0,3.0,0.0,1.0,0.0
1091, Budget $80bn better than tip," The Cairns Post; Cairns, Qld."," Oct 1, 2021",0.0,35.07142857142857,12.428571428571429,14.0,,Doherty,,0.004244382256804616,6.0,1.0,0.0,0.0,0.0
1092, Budget $80bn better than tip," Townsville Bulletin; Townsville, Qld."," Oct 1, 2021",0.0,35.07142857142857,12.428571428571429,14.0,,Doherty,,0.004244382256804616,6.0,1.0,0.0,0.0,0.0
1093, Second doses critical," Herald Sun; Melbourne, Vic."," Oct 1, 2021",0.0,27.304347826086957,8.695652173913043,23.0,Burnet,,,0.022082765912689185,3.0,0.0,0.0,0.0,0.0
1094," Fear over cancer, cardiac deaths"," Herald Sun; Melbourne, Vic."," Oct 1, 2021",0.0,34.36363636363637,11.045454545454545,22.0,,Doherty,,-0.020336727883167514,6.0,1.0,-1.0,1.0,-0.16666666666666666
1095, Uniting a divided cabinet," The Courier - Mail; Brisbane, Qld."," Oct 1, 2021",0.0,31.923076923076923,11.615384615384615,13.0,,Doherty,,0.03932082896039832,4.0,1.0,1.0,0.0,0.25
1096," Fear over cancer, cardiac deaths"," Herald Sun; Melbourne, Vic."," Oct 1, 2021",0.0,34.36363636363637,11.045454545454545,22.0,,Doherty,,-0.020336727883167514,6.0,1.0,-1.0,1.0,-0.16666666666666666
1097, Second doses critical," Herald Sun; Melbourne, Vic."," Oct 1, 2021",0.0,27.304347826086957,8.695652173913043,23.0,Burnet,,,0.022082765912689185,3.0,0.0,0.0,0.0,0.0
1098, Budget $80bn better than tip," The Gold Coast Bulletin; Southport, Qld."," Oct 1, 2021",0.0,35.07142857142857,12.428571428571429,14.0,,Doherty,,0.004244382256804616,6.0,1.0,0.0,0.0,0.0
1099, Uniting a divided cabinet," The Courier - Mail; Brisbane, Qld."," Oct 1, 2021",0.0,31.923076923076923,11.615384615384615,13.0,,Doherty,,0.03932082896039832,4.0,1.0,1.0,0.0,0.25
1100, Adapting to uncertainty can conjure a new sense of order," The Au stralian (Online); Canberra, A.C.T."," Aug 13, 2021",0.0,21.65979381443299,8.010309278350515,97.0,,Doherty,,0.02047746194032065,10.0,4.0,1.0,0.0,0.1
1101, Kiwis opt for caution as world battles to open up," The Australian (Online); Canberra, A.C.T."," Aug 12, 2021",0.0,25.04,8.64,25.0,,Doherty,,0.04044584514465457,10.0,4.0,-1.0,1.0,-0.1
1102, 15 new cases as South Melbourne Market named as Tier 1 site, Herald Sun (Online); Melbourne," Aug 12, 2021",1.0,26.357142857142858,8.785714285714286,14.0,,,,-0.0025645250739235697,12.0,2.0,0.0,0.0,0.0
1103, More western NSW LGAs awake to lockdown, AAP Bulletin Wire; Sydney," Aug 12, 2021",0.0,27.318181818181817,8.545454545454545,22.0,,Doherty,,0.010035583185647194,7.0,1.0,0.0,0.0,0.0
1104, NSW freedom to come at 80% jab mark," The Canberra Times; Canberra, A.C.T."," Aug 12, 2021",0.0,26.3,9.3,20.0,,Doherty,,-0.0011796536796536776,9.0,2.0,1.0,0.0,0.1111111111111111
1105, NSW freedom to come at 80% jab mark," The Canberra Times; Canberra, A.C.T."," Aug 12, 2021",0.0,26.3,9.3,20.0,,Doherty,,-0.0011796536796536776,9.0,2.0,1.0,0.0,0.1111111111111111
1106, Coronavirus Australia live news: Western NSW regions plunged into snap lockdown," The Australian (Online); Canberra, A.C.T."," Aug 11, 2021",1.0,30.661654135338345,10.082706766917294,133.0,,,,0.02344956238393559,12.0,1.0,0.0,0.0,0.0
1107, More western NSW LGAs awake to lockdown, AAP General News Wire; Sydney," Aug 11, 2021",1.0,31.0,9.333333333333334,3.0,,,,-0.0037348272642390296,7.0,1.0,0.0,0.0,0.0
1108, More western NSW LGAs awake to lockdown, AAP General News Wire; Sydney," Aug 11, 2021",1.0,25.785714285714285,7.928571428571429,14.0,,,,-0.017493316974883794,7.0,1.0,0.0,0.0,0.0
1109, Freedom back once 80pc jabbed: Berejiklian, AAP General News Wire; Sydney," Aug 11, 2021",0.0,30.4,9.6,5.0,,Doherty,,0.04253968253968254,7.0,1.0,0.0,0.0,0.0
1110, Freedom back once 80pc jabbed: Berejiklian, AAP General News Wire; Sydney," Aug 11, 2021",0.0,30.4,9.6,5.0,,Doherty,,0.04253968253968254,7.0,1.0,0.0,0.0,0.0
1111, Freedom back once 80pc jabbed: Berejiklian, AAP Bulletin Wire; Sydney," Aug 11, 2021",0.0,25.25,8.59375,32.0,,Doherty,,-0.0014430014430014421,7.0,1.0,0.0,0.0,0.0
1112, Freedom back once 80pc jabbed: Berejiklian, AAP General News Wire; Sydney," Aug 11, 2021",0.0,28.375,9.75,8.0,,Doherty,,0.026587301587301587,7.0,1.0,0.0,0.0,0.0
1113, Vaccine targets review for NT," The Northern Territory News; Darwin, N.T."," Aug 11, 2021",0.0,29.466666666666665,9.2,15.0,,Doherty,,0.03232494019079385,5.0,1.0,0.0,0.0,0.0
1114, VIC LAGGING IN JAB RACE," Herald Sun; Melbourne, Vic."," Aug 11, 2021",0.0,31.77777777777778,10.148148148148149,27.0,,Doherty,,0.023210610105924106,5.0,0.0,0.0,0.0,0.0
1115, NT News TIME TO END VACCINE UNCERTAINTY," The Northern Territory News; Darwin, N.T."," Aug 11, 2021",0.0,29.11111111111111,12.666666666666666,9.0,,Doherty,,0.053815937149270486,7.0,0.0,0.0,0.0,0.0
1116, VIC LAGGING IN JAB RACE," Herald Sun; Melbourne, Vic."," Aug 11, 2021",0.0,34.56521739130435,11.391304347826088,23.0,,Doherty,,0.030250006464890466,5.0,0.0,0.0,0.0,0.0
1117, National plan to manage COVID-19 into the future," The Camden Haven Courier; Laurieton, N.S.W."," Aug 11, 2021",0.0,22.533333333333335,6.2,15.0,,Doherty,,0.044762190940680645,8.0,3.0,1.0,0.0,0.125
1118, NSW stuck in limbo," Sydney Morning Herald; Sydney, N.S.W."," Aug 11, 2021",0.0,29.914285714285715,10.914285714285715,35.0,,Doherty,,0.006054341244562899,4.0,1.0,0.0,0.0,0.0
1119, When Victoria will hit 70 per cent vaccination rate, Herald Sun (Online); Melbourne," Aug 10, 2021",0.0,32.130434782608695,11.130434782608695,23.0,,Doherty,,0.026465654459102986,9.0,1.0,-1.0,0.0,-0.1111111111111111
1120," Coronavirus Australia live news: Gladys Berejiklian plans freedoms for the vaccinated as NSW records 344 new cases, two deaths"," The Australian (Online); Canberra, A.C.T."," Aug 10, 2021",1.0,30.363636363636363,9.927272727272728,55.0,,,,0.021698877225283644,21.0,3.0,0.0,0.0,0.0
1121, When Sydney lockdown was recommended revealed," News.com.au; Sydney, N.S.W."," Aug 10, 2021",0.0,34.2962962962963,12.62962962962963,27.0,,Doherty,,0.02682931350040316,6.0,1.0,0.0,0.0,0.0
1122, Covid-19 Australia: Health Minister Greg Hunt admits lockdowns could remain even if we hit vaccination target," News.com.au; Sydney, N.S.W."," Aug 10, 2021",0.0,26.85,10.4,20.0,,Doherty,,0.039645644773499224,17.0,2.0,-1.0,0.0,-0.058823529411764705
1123, NSW handling of pandemic under spotlight, AAP Bulletin Wire; Sydney," Aug 10, 2021",0.0,26.291666666666668,8.791666666666666,24.0,,Doherty,,0.02318926988044635,6.0,2.0,-1.0,1.0,-0.16666666666666666
1124, NSW handling of pandemic under spotlight, AAP General News Wire; Sydney," Aug 10, 2021",1.0,29.6,11.0,5.0,,,,0.0508624502432552,6.0,2.0,-1.0,1.0,-0.16666666666666666
1125, NSW handling of pandemic under spotlight, AAP General News Wire; Sydney," Aug 10, 2021",1.0,29.6,11.0,5.0,,,,0.0508624502432552,6.0,2.0,-1.0,1.0,-0.16666666666666666
1126, Bosses flag return to work for the jabbed," The Australian; Canberra, A.C.T."," Aug 10, 2021",0.0,35.0,11.789473684210526,19.0,,Doherty,,-0.001223344570576566,8.0,3.0,0.0,0.0,0.0
1127, What will 70% jab coverage mean?:   Analysis," The Age; Melbourne, Vic."," Aug 10, 2021",0.0,25.88235294117647,9.058823529411764,34.0,,Doherty,,0.07420394103266408,10.0,1.0,0.0,0.0,0.0
1128, No accounting for   Covid-dumb fearmongering," The Australian (Online); Canberra, A.C.T."," Aug 9, 2021",0.0,26.317073170731707,8.682926829268293,41.0,Burnet,,,-0.005521514464660909,5.0,1.0,0.0,0.0,0.0
1129, Bosses flag return to work in NSW for the Covid-19 vaccinated," The Australian (Online); Canberra, A.C.T."," Aug 9, 2021",0.0,34.77777777777778,11.777777777777779,18.0,,Doherty,,-0.004379291673611191,11.0,4.0,0.0,0.0,0.0
1130, COVID CRISIS Dealing with the virus into future," The Gold Coast Bulletin; Southport, Qld."," Aug 9, 2021",0.0,41.0,14.555555555555555,9.0,,Doherty,,0.0277581312677498,8.0,3.0,-1.0,0.0,-0.125
1131, Contact tracers here to stay as we learn to live with virus," The Courier - Mail; Brisbane, Qld."," Aug 9, 2021",0.0,37.3,13.1,10.0,,Doherty,,0.03896719101460481,12.0,6.0,0.0,0.0,0.0
1132, Contact tracers here to stay as we learn to live with virus," The Daily Telegraph; Surry Hills, N.S.W."," Aug 9, 2021",0.0,37.2,12.9,10.0,,Doherty,,0.03916481947310283,12.0,6.0,0.0,0.0,0.0
1133, Contact tracers here to stay as we learn to live with virus," The Courier - Mail; Brisbane, Qld."," Aug 9, 2021",0.0,37.3,13.1,10.0,,Doherty,,0.03896719101460481,12.0,6.0,0.0,0.0,0.0
1134, Contact tracers here to stay as we learn to live with virus," The Daily Telegraph; Surry Hills, N.S.W."," Aug 9, 2021",0.0,37.2,12.9,10.0,,Doherty,,0.03916481947310283,12.0,6.0,0.0,0.0,0.0
1135, Vaccination levels pave way back to work," The Australian; Canberra, A.C.T."," Aug 9, 2021",0.0,34.45,13.4,20.0,,Doherty,,0.014059507513949876,7.0,1.0,0.0,0.0,0.0
1136, CORONAVIRUS MOVING FORWARD Contact tracers to stay," The Advertiser; Adelaide, S. Aust."," Aug 9, 2021",0.0,32.3125,11.3125,16.0,,Doherty,,0.043328826570914164,7.0,1.0,0.0,0.0,0.0
1137, CORONAVIRUS MOVING FORWARD Contact tracers to stay," The Advertiser; Adelaide, S. Aust."," Aug 9, 2021",0.0,32.3125,11.3125,16.0,,Doherty,,0.043328826570914164,7.0,1.0,0.0,0.0,0.0
1138, When a quick buck is more important than your freedom," The Age; Melbourne, Vic."," Aug 9, 2021",0.0,25.29032258064516,8.806451612903226,31.0,,Doherty,,-0.012941204274726795,10.0,5.0,2.0,1.0,0.2
1139, When a quick buck is more important than your freedom," Sydney Morning Herald; Sydney, N.S.W."," Aug 9, 2021",0.0,25.29032258064516,8.806451612903226,31.0,,Doherty,,-0.012941204274726795,10.0,5.0,2.0,1.0,0.2
1140, ‘We just won’t know when the next outbreak is going to be’: Qld Premier," The Courier - Mail (Online); Brisbane, Qld."," Aug 8, 2021",0.0,32.90909090909091,12.303030303030303,33.0,,Doherty,,0.03286191511733822,19.0,8.0,0.0,0.0,0.0
1141, How sick must nation become before we are well again?," The Australian (Online); Canberra, A.C.T."," Aug 8, 2021",0.0,20.0,6.921052631578948,38.0,,Doherty,,0.020355974630032195,11.0,4.0,-1.0,0.0,-0.09090909090909091
1142, Coronavirus Australia live news: Victoria opens first drive-thru vaccine clinic; NSW records 262 new cases," The Australian (Online); Canberra, A.C.T."," Aug 8, 2021",0.0,33.87931034482759,11.172413793103448,58.0,,Doherty,,0.001951352685569044,17.0,0.0,1.0,0.0,0.058823529411764705
1143, Vaccination levels pave way back to work," The Australian (Online); Canberra, A.C.T."," Aug 8, 2021",0.0,35.611111111111114,13.944444444444445,18.0,,Doherty,,0.017936489830314675,7.0,1.0,0.0,0.0,0.0
1144, Taking vaccines straight into Covid-19 areas the ‘circuit breaker’ Sydney needs," The Daily Telegraph (Online); Surrey Hills, N.S.W."," Aug 8, 2021",0.0,36.0,12.2,20.0,,Doherty,,0.0039745376457333,13.0,2.0,0.0,0.0,0.0
1145, Sunday Mail Editorial We all need to be part of solution," The Advertiser; Adelaide, S. Aust."," Aug 8, 2021",0.0,27.428571428571427,10.5,14.0,,Doherty,,0.0769974501066938,11.0,4.0,1.0,0.0,0.09090909090909091
1146, Who decides what's too dangerous to hear?," Sun Herald; Sydney, N.S.W."," Aug 8, 2021",0.0,23.080645161290324,7.67741935483871,62.0,,Doherty,,0.012155644271393796,9.0,3.0,-1.0,1.0,-0.1111111111111111
1147," Australia struggles under Delta load as new COVID lockdowns mean majority of Australia at home again:   With the highly transmissible Delta variant snaking its way up and down the east coast, ""go hard, go early"" has become the nationwide approach — and we're seeing it daily.", ABC Premium News; Sydney," Aug 7, 2021",0.0,27.962025316455698,9.670886075949367,79.0,,Doherty,,0.016597563915391474,53.0,16.0,2.0,0.0,0.03773584905660377
1148, Top doc praises reaction to Delta," The Courier - Mail; Brisbane, Qld."," Aug 7, 2021",0.0,30.11764705882353,10.470588235294118,17.0,,Doherty,,0.04107980917443833,6.0,1.0,0.0,0.0,0.0
1149, Coronavirus Australia live news: Victoria opens first drive-thru vaccine clinic; NSW records 262 new cases," The Australian (Online); Canberra, A.C.T."," Aug 7, 2021",1.0,31.612903225806452,10.451612903225806,31.0,,,,0.009952350937410315,17.0,0.0,1.0,0.0,0.058823529411764705
1150, Top doc praises reaction to Delta," The Courier - Mail; Brisbane, Qld."," Aug 7, 2021",0.0,30.11764705882353,10.470588235294118,17.0,,Doherty,,0.04107980917443833,6.0,1.0,0.0,0.0,0.0
1151, HOW WE CAN BE OPEN BY CHRISTMAS," The Courier - Mail; Brisbane, Qld."," Aug 7, 2021",0.0,33.11363636363637,12.727272727272727,44.0,,Doherty,,0.033260935224013036,7.0,0.0,0.0,0.0,0.0
1152, TOGETHER WE GROW STRONGER," Herald Sun; Melbourne, Vic."," Aug 7, 2021",0.0,24.0,9.35135135135135,37.0,,Doherty,,0.029894155048953812,4.0,0.0,0.0,0.0,0.0
1153, DELTA A SWORD ABOVE OUR HEADS," Herald Sun; Melbourne, Vic."," Aug 7, 2021",0.0,29.419354838709676,10.064516129032258,31.0,,Doherty,,-0.0047477691022267485,6.0,0.0,0.0,0.0,0.0
1154, DELTA A SWORD ABOVE OUR HEADS," Herald Sun; Melbourne, Vic."," Aug 7, 2021",0.0,28.838709677419356,9.838709677419354,31.0,,Doherty,,0.020750331980043703,6.0,0.0,0.0,0.0,0.0
1155, ‘Older Aussies should encourage grandkids to get shots’," Weekend Australian; Canberra, A.C.T."," Aug 7, 2021",0.0,24.23076923076923,8.461538461538462,26.0,,Doherty,,0.0210230898437912,10.0,2.0,1.0,0.0,0.1
1156, UNMASKING THE PATH TO FREEDOM," Weekend Australian; Canberra, A.C.T."," Aug 7, 2021",0.0,18.235294117647058,6.022058823529412,136.0,,Doherty,,0.0229818094374109,5.0,0.0,0.0,0.0,0.0
1157, Cabinet refuses to back bosses ordering workers to get jab," The Daily Telegraph; Surry Hills, N.S.W."," Aug 7, 2021",0.0,20.941176470588236,7.882352941176471,17.0,,Doherty,,0.017283100405937776,10.0,2.0,0.0,0.0,0.0
1158, Politicians have abdicated responsibility for this crisis," Weekend Australian; Canberra, A.C.T."," Aug 7, 2021",0.0,26.691176470588236,9.867647058823529,68.0,,Doherty,,-0.0017264178716927976,7.0,3.0,-1.0,0.0,-0.14285714285714285
1159, We will need an inquiry to learn from rollout mistakes," The Canberra Times; Canberra, A.C.T."," Aug 7, 2021",0.0,22.585365853658537,8.317073170731707,41.0,,Doherty,,0.023824815905537797,10.0,4.0,2.0,0.0,0.2
1160, We will need an inquiry to learn from rollout mistakes," The Canberra Times; Canberra, A.C.T."," Aug 7, 2021",0.0,22.585365853658537,8.317073170731707,41.0,,Doherty,,0.023824815905537797,10.0,4.0,2.0,0.0,0.2
1161, Warning lockdowns to be more f requent," The Age; Melbourne, Vic."," Aug 7, 2021",0.0,27.22222222222222,9.833333333333334,36.0,Burnet,Doherty,Thompson,0.007255802172942499,7.0,3.0,0.0,0.0,0.0
1162, Warning more lockdowns loom," The Age; Melbourne, Vic."," Aug 7, 2021",0.0,21.11111111111111,6.888888888888889,9.0,,Doherty,Thompson,0.0041644515328725824,4.0,1.0,-1.0,1.0,-0.25
1163, Premier's gambit: All bets on vaccination rate," Sydney Morning Herald; Sydney, N.S.W."," Aug 7, 2021",0.0,25.24390243902439,8.548780487804878,82.0,,Doherty,,0.022070228542263398,9.0,1.0,0.0,0.0,0.0
1164, Coronavirus Australia live news: NSW records 319 new cases; Victoria records 29 new cases; Queensland records 13 new cases," The Australian (Online); Canberra, A.C.T."," Aug 6, 2021",1.0,36.6,11.566666666666666,30.0,,,,0.010277029880905186,22.0,0.0,0.0,0.0,0.0
1165, Unmasking the truth about the path to freedom," The Australian (Online); Canberra, A.C.T."," Aug 6, 2021",0.0,18.029850746268657,5.932835820895522,134.0,,Doherty,,0.0238845230111036,8.0,4.0,2.0,0.0,0.25
1166, Politicians have abdicated responsibility for this Covid crisis," The Australian (Online); Canberra, A.C.T."," Aug 6, 2021",0.0,27.46153846153846,10.2,65.0,,Doherty,,-0.004811377731230956,8.0,3.0,-1.0,0.0,-0.125
1167, D-Day for Delta: Spike in Victoria’s Covid case numbers as 29 new infections recorded, Herald Sun (Online); Melbourne," Aug 6, 2021",1.0,25.692307692307693,10.0,39.0,,,,0.0132630634097679,17.0,4.0,0.0,1.0,0.0
1168, Flight Centre boss Graham ‘Skroo’ Turner: The prices we must pay for Covid freedom," The Courier - Mail (Online); Brisbane, Qld."," Aug 6, 2021",0.0,32.297872340425535,12.702127659574469,47.0,,Doherty,,0.03577312692635056,17.0,2.0,2.0,0.0,0.11764705882352941
1169, Josh Frydenberg: Why Victorians can be confident about their future, Herald Sun (Online); Melbourne," Aug 6, 2021",0.0,24.166666666666668,9.5,36.0,,Doherty,,0.027638128491671663,11.0,4.0,1.0,0.0,0.09090909090909091
1170, Pollies getting snappy," Herald Sun; Melbourne, Vic."," Aug 6, 2021",0.0,26.047619047619047,9.285714285714286,21.0,,Doherty,,0.01638047306997868,3.0,0.0,0.0,0.0,0.0
1171, Pollies getting snappy," Herald Sun; Melbourne, Vic."," Aug 6, 2021",0.0,26.047619047619047,9.285714285714286,21.0,,Doherty,,0.01638047306997868,3.0,0.0,0.0,0.0,0.0
1172, ‘We could hit 80pc by November’," The Australian; Canberra, A.C.T."," Aug 6, 2021",0.0,38.61538461538461,12.076923076923077,13.0,,Doherty,,0.019730176961039382,8.0,1.0,-1.0,0.0,-0.125
1173," Aussies could face more lockdowns, despite vaccinations"," Hawkes Bay Today; Hastings, New Zealand"," Aug 5, 2021",0.0,29.894736842105264,10.0,19.0,,Doherty,,0.006040369529469855,8.0,1.0,0.0,0.0,0.0
1174," Aussies could face more lockdowns, despite vaccinations"," The Daily Post; Rotorua, New Zealand"," Aug 5, 2021",0.0,29.894736842105264,10.0,19.0,,Doherty,,0.006040369529469855,8.0,1.0,0.0,0.0,0.0
1175," Aussies could face more lockdowns, despite vaccinations"," Bay of Plenty Times; Tauranga, New Zealand"," Aug 5, 2021",0.0,29.894736842105264,10.0,19.0,,Doherty,,0.006040369529469855,8.0,1.0,0.0,0.0,0.0
1176," Why Aussies could face more lockdowns, despite vaccinations"," The New Zealand Herald; Auckland, New Zealand"," Aug 5, 2021",0.0,31.533333333333335,10.733333333333333,15.0,,Doherty,,0.008563245314668465,9.0,1.0,0.0,0.0,0.0
1177," Aussies could face more lockdowns, despite vaccinations"," Wanganui Chronicle; Wanganui, New Zealand"," Aug 5, 2021",0.0,29.894736842105264,10.0,19.0,,Doherty,,0.006040369529469855,8.0,1.0,0.0,0.0,0.0
1178," Coronavirus Australia live news: National cabinet agrees Covid plan; worst day yet for NSW with 291 cases; 10 in Qld, six in Victoria"," The Australian (Online); Canberra, A.C.T."," Aug 5, 2021",0.0,34.093333333333334,11.32,75.0,,Doherty,,0.038209185272552945,27.0,4.0,1.0,0.0,0.037037037037037035
1179," Queensland border bubble being tested as COVID-19 Delta outbreak extends to neighbouring Coffs Harbour:   Queenslanders in the NSW border zone are placed on high alert as the COVID-19 Delta outbreak spreads outside Greater Sydney, with experts despairing at the decision not to put a 'ring of steel' around the harbour city.", ABC Premium News; Sydney," Aug 5, 2021",0.0,24.615384615384617,8.038461538461538,26.0,Burnet,,,0.015342830246676402,55.0,17.0,-1.0,1.0,-0.01818181818181818
1180," Covid-19: ‘We could hit 80pc fully vaccinated by November’, economists say"," The Australian (Online); Canberra, A.C.T."," Aug 5, 2021",0.0,42.27272727272727,13.363636363636363,11.0,,Doherty,,0.02764648619205087,15.0,1.0,0.0,0.0,0.0
1181, Snap lockdowns now backed by Fed Gov, Herald Sun (Online); Melb ourne," Aug 5, 2021",0.0,27.526315789473685,10.0,19.0,,Doherty,,0.01619971618117404,7.0,2.0,0.0,0.0,0.0
1182, Victoria enters its sixth lockdown," The Australian (Online); Canberra, A.C.T."," Aug 5, 2021",1.0,31.214285714285715,10.452380952380953,42.0,,Doherty,,-0.01234762403155163,5.0,1.0,0.0,0.0,0.0
1183, Opening up tougher than locking us down," The Courier - Mail; Brisbane, Qld."," Aug 5, 2021",0.0,30.125,11.708333333333334,24.0,,Doherty,,-0.008727884922737862,7.0,3.0,0.0,0.0,0.0
1184, Virus cases lock down bulk of Australians, AAP General News Wire; Sydney," Aug 5, 2021",0.0,22.0,7.0476190476190474,21.0,,Doherty,,0.010680097500088656,7.0,2.0,0.0,0.0,0.0
1185," Don’t wait for Pfizer, get AZ now"," The Australian; Canberra, A.C.T."," Aug 5, 2021",0.0,33.333333333333336,10.121212121212121,33.0,,Doherty,,0.016343846695249586,10.0,3.0,-1.0,0.0,-0.1
1186, Confusion still reigns," The Daily Telegraph; Surry Hills, N.S.W."," Aug 5, 2021",0.0,28.852941176470587,11.235294117647058,34.0,,Doherty,,0.005263109304208816,3.0,0.0,0.0,0.0,0.0
1187, Covid normal demands big change of attitude," Herald Sun; Melbourne, Vic."," Aug 5, 2021",0.0,22.522727272727273,8.590909090909092,44.0,,Doherty,,0.013060477680605042,7.0,1.0,0.0,1.0,0.0
1188, Opening up tougher than locking us down," The Courier - Mail; Brisbane, Qld."," Aug 5, 2021",0.0,30.125,11.708333333333334,24.0,,Doherty,,-0.008727884922737862,7.0,3.0,0.0,0.0,0.0
1189, Vaccine hesitancy is rife among year 12s," The Australian; Canberra, A.C.T."," Aug 5, 2021",0.0,29.63157894736842,9.894736842105264,19.0,,Doherty,,0.033420347544051945,7.0,1.0,-1.0,0.0,-0.14285714285714285
1190," Don’t wait for Pfizer, get AZ now"," The Australian; Canberra, A.C.T."," Aug 5, 2021",0.0,33.63636363636363,10.212121212121213,33.0,,Doherty,,0.0152648751617326,10.0,3.0,-1.0,0.0,-0.1
1191, Vaccine hesitancy is rife among year 12s," The Australian; Canberra, A.C.T."," Aug 5, 2021",0.0,29.57894736842105,9.894736842105264,19.0,,Doherty,,0.033420347544051945,7.0,1.0,-1.0,0.0,-0.14285714285714285
1192," Don’t wait for Pfizer, get AZ now"," The Australian; Canberra, A.C.T."," Aug 5, 2021",0.0,33.39393939393939,10.121212121212121,33.0,,Doherty,,0.016343846695249586,10.0,3.0,-1.0,0.0,-0.1
1193, Vaccine assurances as doses redirected to Sydney," Port Stephens Examiner; Raymond Terrace, N.S.W."," Aug 5, 2021",0.0,26.56756756756757,10.27027027027027,37.0,,Doherty,,0.023206881759513336,7.0,2.0,0.0,0.0,0.0
1194, Data reveals the take up of vaccinations in the South Coast and Southern Highlands," South Coast Register; Nowra, N.S.W."," Aug 5, 2021",0.0,24.25,8.208333333333334,24.0,,Doherty,,0.04804743462860465,14.0,6.0,0.0,0.0,0.0
1195, Bosses vital to attain vaccination surge:   'DELTA HAS MOVED THE NEEDLE'," Sydney Morning Herald; Sydney, N.S.W."," Aug 5, 2021",0.0,29.5625,9.6875,16.0,,Doherty,,0.013544772747808803,13.0,1.0,1.0,0.0,0.07692307692307693
1196, Ex-adviser to Biden urges jab mandates," The Age; Melbourne, Vic."," Aug 5, 2021",0.0,28.59090909090909,9.5,22.0,,Doherty,,0.02880905555380818,6.0,1.0,0.0,0.0,0.0
1197, Jab parents to protect children: expert," Illawarra Mercury; Wollongong, N.S.W."," Aug 4, 2021",0.0,23.076923076923077,7.846153846153846,13.0,,Doherty,,0.06275581804874493,7.0,1.0,2.0,0.0,0.2857142857142857
1198, QRR plan to let flights overseas resume:   VACCINATED TRAVELLERS | EXCLUSIVE," Sydney Morning Herald; Sydney, N.S.W."," Aug 4, 2021",0.0,29.72,9.52,25.0,,Doherty,,0.03224808992428044,12.0,1.0,0.0,0.0,0.0
1199, Path from lockdown hinges on vaccination," Sydney Morning Herald; Sydney, N.S.W."," Aug 4, 2021",0.0,28.0,8.3125,16.0,,Doherty,,0.04367131446293346,6.0,2.0,0.0,0.0,0.0
1200," Victorian COVID-19 lockdown not ruled out as two new cases reported today, six yesterday:   Premier Daniel Andrews says his government wants to avoid replicating the situation in Sydney, but no decisions have been made on whether Melbourne needs to enter another lockdown to deal with the new cases.", ABC Premium News; Sydney," Aug 4, 2021",0.0,22.92063492063492,7.809523809523809,63.0,,Doherty,,-0.00017463471527553084,52.0,16.0,-1.0,2.0,-0.019230769230769232
